experiment_condition	has_either	has_neither	conj_1_number	conj_1_person	conj_2_number	conj_2_person	nsubj	verb_form	verb_lemma	verb_number	main_predicate_lemma	main_predicate_arc	sentence	filename
SS	False	False	Sing	3	Sing	3	he or she	comes	come	Sing	come	root	That he or she comes recommended.	c4-train.00001-of-01024_parsed_xac.conllu
SS	False	False	Sing	3	Sing	3	he or she	communicates	communicate	Sing	communicate	conj	Make sure you feel comfortable with your advisor, and he or she communicates with you in a way that works for your personality and your life.	c4-train.00001-of-01024_parsed_xac.conllu
SS	False	False	Sing	Not Pronoun	Sing	Not Pronoun	KamDev powerful mantra to Attract husband in Abids or vashikaran mantra to control your husband in Abids	is	be	Sing	choice	cop	Then, KamDev powerful mantra to Attract husband in Abids or vashikaran mantra to control your husband in Abids is the best choice for you.	c4-train.00001-of-01024_parsed_xac.conllu
SS	False	False	Sing	Not Pronoun	Sing	Not Pronoun	The Jewish prayer shawl , or tallit ,	has	have	Sing	have	root	The Jewish prayer shawl, or tallit, has fringes on the corners which are referred to as wings.	c4-train.00001-of-01024_parsed_xac.conllu
UNK	False	False	UNK	Not Pronoun	UNK	Not Pronoun	two or three	come	come	Plur	come	advcl	For where two or three come together in my name, there am I with them."	c4-train.00001-of-01024_parsed_xac.conllu
SS	False	False	Sing	3	Sing	3	he or she	needs	need	Sing	need	acl:relcl	Often times, dog walkers are the first to notice that your dog might be sick or in distress and they can help make sure your pet gets the care he or she needs.	c4-train.00001-of-01024_parsed_xac.conllu
SS	False	False	Sing	Not Pronoun	Sing	Not Pronoun	Neck strain or sprain	is	be	Sing	type	cop	Neck strain or sprain is the most common type of injury to motor vehicle occupants treated in U.S. hospital emergency departments.	c4-train.00001-of-01024_parsed_xac.conllu
SS	False	False	Sing	3	Sing	3	he or she	perform	perform		perform	ccomp	Please please please please PLEASE, if you have a kid who is learning an instrument, don’t demand that he or she perform for people other than the audiences he or she must perform for at recitals.	c4-train.00001-of-01024_parsed_xac.conllu
SP	False	False	Sing	Not Pronoun	Plur	Not Pronoun	The organizer and / or officials	retains	retain	Sing	retain	root	The organizer and/or officials retains the full right to refuse any racer from racing.	c4-train.00001-of-01024_parsed_xac.conllu
PS	False	False	Plur	Not Pronoun	Sing	Not Pronoun	smartphones or scanner	access	access	Plur	access	advcl	When smartphones or scanner access the code, then it offers several details directly and via websites as well.	c4-train.00001-of-01024_parsed_xac.conllu
SS	False	False	Sing	Not Pronoun	Sing	Not Pronoun	A long leash or tether	is	be	Sing	way	cop	Tether and Stake – A long leash or tether is a great way to allow your dog to explore the campsite while you relax knowing he’ll stay in the area.	c4-train.00001-of-01024_parsed_xac.conllu
UNK	False	False	UNK	Not Pronoun	Sing	Not Pronoun	522 ( or 1 % of the 69,423 people )	are	be	Plur	resident	cop	However, 522 (or 1% of the 69,423 people) are not residents by choice but are people in prison.	c4-train.00001-of-01024_parsed_xac.conllu
SP	False	False	Sing	Not Pronoun	Plur	Not Pronoun	the coach or the fans	like	like	Plur	like	acl:relcl	Throw one too many bad pitches and the pitcher, no matter how much the coach or the fans like him, will be replaced on the mound.	c4-train.00001-of-01024_parsed_xac.conllu
PP	False	False	Plur	Not Pronoun	Plur	Not Pronoun	Private journals , or diaries ,	are	be	Plur	feature	cop	Private journals, or diaries, are a feature in The Sims 2 and The Sims 4: Parenthood.	c4-train.00001-of-01024_parsed_xac.conllu
SP	False	False	Sing	Not Pronoun	Plur	Not Pronoun	the way the cough sounds , the intensity of the cough , or the triggers that cause the cough	changes	change	Sing	change	advcl	If the way the cough sounds, the intensity of the cough, or the triggers that cause the cough changes, it could be an indication of something serious such as lung cancer.	c4-train.00001-of-01024_parsed_xac.conllu
UNK	False	False	UNK	2	Sing	Not Pronoun	you or an aging loved one	are	be	Sing	consider	aux	If you or an aging loved one are considering Home Care Services in Medfield MA, or anywhere in Eastern Massachusetts, please call the caring staff at CARE Resolutions – (508) 906-5572.	c4-train.00001-of-01024_parsed_xac.conllu
SS	False	False	Sing	Not Pronoun	Sing	Not Pronoun	the mommy or daddy	hangs	hang	Sing	hang	ccomp	Sometimes when they see the mommy or daddy still hangs in the premises they started to become clingy.	c4-train.00001-of-01024_parsed_xac.conllu
SS	False	False	Sing	3	Sing	3	he or she	prefers	prefer	Sing	prefer	acl:relcl	With 6 different blocks made from either solid maple or solid walnut, Blox empowers the modern office worker with the ability to make the kind of changes in the way things are organized on top of his or her office desk in a manner that he or she prefers or see fits.	c4-train.00001-of-01024_parsed_xac.conllu
UNK	False	False	UNK	Not Pronoun	UNK	Not Pronoun	“ search by SKU ” or enabling multiple purchases for inventory shipped to several locations	make	make	Plur	make	root	Insider industry “search by SKU” or enabling multiple purchases for inventory shipped to several locations make things easier and faster for frequent corporate customers.	c4-train.00001-of-01024_parsed_xac.conllu
UNK	False	False	UNK	2	Sing	Not Personal Pronoun	you or someone you know	is	be	Sing	suffer	aux	If you or someone you know is suffering from anxiety, please seek professional medical advice or contact Lifeline on 13 11 14.	c4-train.00001-of-01024_parsed_xac.conllu
PP	False	False	Plur	Not Pronoun	Plur	Not Pronoun	student internships or summer jobs	do	do	Plur	qualify	aux	Work experience comprising at least 24 months of relevant professional experience in a business environment following graduation (student internships or summer jobs do not qualify for consideration).	c4-train.00001-of-01024_parsed_xac.conllu
SS	False	False	Sing	Not Pronoun	Sing	Not Pronoun	their local number or toll free number	forwards	forward	Sing	forward	acl:relcl	Anyone with an internet connection can login into the service provider’s portal and subsequently change the numbers to which their local number or toll free number forwards.	c4-train.00001-of-01024_parsed_xac.conllu
UNK	False	False	UNK	Not Pronoun	Sing	Not Pronoun	Dutch and / or German	is	be	Sing	advantage	cop	Fluent in English is a must; Dutch and/or German is an advantage.	c4-train.00001-of-01024_parsed_xac.conllu
PP	False	False	Plur	Not Pronoun	Plur	Not Pronoun	Virtual files rooms , or maybe VDRs ,	give	give	Plur	give	root	Virtual files rooms, or maybe VDRs, give quite a few benefits which an individual is just not look for within a standard record discussing service plan.	c4-train.00001-of-01024_parsed_xac.conllu
SS	False	False	Sing	Not Pronoun	Sing	Not Pronoun	the cell or organism	alters	alter	Sing	alter	acl:relcl	The anti-climax of a null result may stem from adaptation where the cell or organism alters other gene pathways to compensate for the loss-of-function of the target gene.	c4-train.00001-of-01024_parsed_xac.conllu
SS	False	False	Sing	Not Pronoun	Sing	Not Pronoun	every change or development	is	be	Sing	detail	cop	Well, every change or development is yet another detail that could impact your pending case, for better or worse.	c4-train.00001-of-01024_parsed_xac.conllu
SP	False	False	Sing	Not Pronoun	Plur	Not Pronoun	pricing or menu items	need	need	Plur	need	advcl	A simple solution when pricing or menu items need to be changed requiring only single sheets to be reprinted rather than your entire menu.	c4-train.00001-of-01024_parsed_xac.conllu
PP	False	False	Plur	Not Pronoun	Plur	Not Pronoun	Many banks or financial lenders	do	do	Plur	look	aux	Many banks or financial lenders don’t just look at the size or needs of a loan; they also consider the cost of the funds and the tenor or the length of time for which the money are required.	c4-train.00001-of-01024_parsed_xac.conllu
SS	False	False	Sing	Not Pronoun	Sing	Not Pronoun	the inner guru , or supreme intelligence abiding in the crown chakra	becomes	become	Sing	become	root	Through its repetition the inner guru, or supreme intelligence abiding in the crown chakra becomes accessible.	c4-train.00001-of-01024_parsed_xac.conllu
SS	False	False	Sing	Not Pronoun	Sing	Not Pronoun	the timer or scroll bar	ends	end	Sing	end	advcl	Wait until the timer or scroll bar ends and the browser automatically credits the money into your account.	c4-train.00001-of-01024_parsed_xac.conllu
SS	False	False	Sing	Not Pronoun	Sing	Not Pronoun	an " answer call " button or menu option	be	be		be	xcomp	So there *still* needs to be an "answer call" button or menu option.	c4-train.00001-of-01024_parsed_xac.conllu
SS	False	False	Sing	Not Pronoun	Sing	Not Pronoun	a harness or collar	is	be	Sing	alternative	cop	As a pet owner, you might be finding it hard to decide whether a harness or collar is a better alternative for your day-to-day usage with your dog.	c4-train.00001-of-01024_parsed_xac.conllu
SS	False	False	Sing	Not Pronoun	Sing	Not Pronoun	your IT team or MSP	are	be	Plur	task	cop	If your IT team or MSP are not up for the task, MRW Systems can help transition your business over to Windows 10.	c4-train.00001-of-01024_parsed_xac.conllu
SP	False	False	Sing	Not Pronoun	Plur	Not Pronoun	the contractor or MoDOT Maintenance personnel	remove	remove		remove	advcl	If the engineer determines that sediment control fence shall remain in place for a period of time after the job is closed out, arrangements will be made for the contractor or MoDOT Maintenance personnel to remove the fence once the area is sufficiently stabilized.	c4-train.00001-of-01024_parsed_xac.conllu
SS	False	False	Sing	Not Pronoun	Sing	Not Pronoun	the restaurant or bar	is	be	Sing	York	cop	Federal law governs copyrights, which means that the law is the same regardless of whether the restaurant or bar is in New York, or another state.	c4-train.00001-of-01024_parsed_xac.conllu
UNK	False	False	UNK	Not Pronoun	UNK	Not Pronoun	Any warmer or colder than that	means	mean	Sing	mean	root	Any warmer or colder than that means the trout will be lazier than it already is!	c4-train.00001-of-01024_parsed_xac.conllu
SS	False	False	Sing	Not Pronoun	Sing	Not Pronoun	the department or a league	absorbing	absorb		absorb	acl	The man couldn't afford to pay it and the days of the department or a league absorbing those fees for families in need are gone.	c4-train.00001-of-01024_parsed_xac.conllu
SS	False	False	Sing	Not Pronoun	Sing	Not Pronoun	multi - color string ( or you odd - n - end leftover string from other projects )	make	make	Plur	make	root	To add that special touch of color to a child's room, multi-color string (or you odd-n-end leftover string from other projects) make a cute accent ball or colorful shade.	c4-train.00001-of-01024_parsed_xac.conllu
SS	False	False	Sing	Not Pronoun	Sing	Not Pronoun	Chronic arthritis or acute joint injury	leads	lead	Sing	lead	root	Chronic arthritis or acute joint injury leads to pain and reduced mobility.	c4-train.00001-of-01024_parsed_xac.conllu
SS	False	False	Sing	Not Pronoun	Sing	Not Pronoun	a preliminary report ( or commitment )	is	be	Sing	what	cop	What is a preliminary report (or commitment)?	c4-train.00001-of-01024_parsed_xac.conllu
SS	False	False	Sing	Not Pronoun	Sing	Not Pronoun	your friend or relative	sends	send	Sing	send	advcl	When your friend or relative sends in their pre-application form from the Alpha Finance website, make sure that they select “Family and Friends” as the source.	c4-train.00001-of-01024_parsed_xac.conllu
SS	False	False	Sing	Not Pronoun	Sing	Not Pronoun	This idea or myth that other countries are doing magic things in breach of the state aid rules without any comeback	is	be	Sing	that	cop	This idea or myth that other countries are doing magic things in breach of the state aid rules without any comeback is just that—an absolute myth.	c4-train.00001-of-01024_parsed_xac.conllu
SP	False	False	Sing	Not Pronoun	Plur	Not Pronoun	a Salvager module or Salvaging Drones	need	need	Plur	need	root	In order to salvage these components, a Salvager module or Salvaging Drones need to be used on the wreck.	c4-train.00001-of-01024_parsed_xac.conllu
SS	False	False	Sing	Not Pronoun	Sing	Not Pronoun	an exemption or exclusion from registration	applies	apply	Sing	apply	advcl	The Commodity Exchange Act, as amended by the Dodd-Frank Wall Street Reform and Consumer Protection Act, (CEA) requires CPOs and CTAs to register with the Commodity Futures Trading Commission (CFTC) and the National Futures Association (NFA), unless an exemption or exclusion from registration applies.	c4-train.00001-of-01024_parsed_xac.conllu
SS	False	False	Sing	Not Pronoun	Sing	Not Pronoun	The terminal ( or ncurses )	does	do	Sing	restore	aux	The terminal (or ncurses) does not restore what was on the screen before ncurses mode was entered.	c4-train.00001-of-01024_parsed_xac.conllu
PP	False	False	Plur	Not Pronoun	Plur	Not Pronoun	Vine & Canvas cancellations or reschedules	require	require	Plur	require	root	Vine & Canvas cancellations or reschedules require a 48 hour notice for all regular Vine & Canvas classes only.	c4-train.00001-of-01024_parsed_xac.conllu
SS	False	False	Sing	Not Pronoun	Sing	Not Pronoun	Software Development Life Cycle , or software process	is	be	Sing	development	cop	Software Development Life Cycle, or software process is the systematic development of software by following every stage in the development process namely, Requirement Gathering, System Analysis, Design, Coding, Testing, Maintenance and Documentation in that order.	c4-train.00001-of-01024_parsed_xac.conllu
SS	False	False	Sing	3	Sing	3	he or she	gets	get	Sing	get	ccomp	Therefore, reading an article on the website, the user will think that he or she gets the information from a real human who stands behind the story.	c4-train.00001-of-01024_parsed_xac.conllu
SS	False	False	Sing	3	Sing	3	he or she	wants	want	Sing	want	acl:relcl	The first sentence should state who the main character is with a hint or full-out statement of what it is he or she wants.	c4-train.00001-of-01024_parsed_xac.conllu
SS	False	False	Sing	Not Pronoun	Sing	Not Pronoun	Your purchase order or website order	is	be	Sing	contract	cop	Your purchase order or website order is a contract to purchase the items on your order.	c4-train.00001-of-01024_parsed_xac.conllu
PP	False	False	Plur	Not Pronoun	Plur	Not Pronoun	Fluid jersey wide - leg pants or palazzos	are	be	Plur	favourite	cop	Fluid jersey wide-leg pants or palazzos are another versatile and easy-to-wear favourite.	c4-train.00001-of-01024_parsed_xac.conllu
SS	False	False	Sing	Not Pronoun	Sing	Not Pronoun	your computer or OS	does	do	Sing	meet	aux	If your computer or OS doesn’t meet requirements, then you can still use the older Docker Toolbox version that uses VirtualBox.	c4-train.00001-of-01024_parsed_xac.conllu
SS	False	False	Sing	3	Sing	3	he or she	has	have	Sing	obtain	aux	When somebody pays you a pay, he or she has obtained in any event some of your time and vitality.	c4-train.00001-of-01024_parsed_xac.conllu
SS	False	False	Sing	Not Pronoun	Sing	Not Pronoun	your top graduate school life hack or survival resource	is	be	Sing	what	cop	What is your top graduate school life hack or survival resource?	c4-train.00001-of-01024_parsed_xac.conllu
SS	False	False	Sing	Not Pronoun	Sing	Not Pronoun	a parent or guardian	believes	believe	Sing	believe	advcl	If a parent or guardian believes that the Website has personally identifiable information of a child under the age of 16 in its database, please contact us immediately at abra@abraskitchen.com and we will use our best efforts to promptly remove such information from our records.	c4-train.00001-of-01024_parsed_xac.conllu
SS	False	False	Sing	Not Pronoun	Sing	Not Pronoun	Sos Pwa ( or Sauce Pois )	is	be	Sing	soup	cop	Sos Pwa (or Sauce Pois) is a bean soup that is flavored with spices and seasonings to serve with white rice or mayi moulen ak zaboka.	c4-train.00001-of-01024_parsed_xac.conllu
SP	False	False	Sing	Not Pronoun	Plur	Not Pronoun	the receiver or other subjects	trace	trace		trace	acl	An open source software that allows anonymous dialogue with the reporter, without any possibility for the receiver or other subjects to trace the source of the messages.	c4-train.00001-of-01024_parsed_xac.conllu
SS	False	False	Sing	Not Pronoun	Sing	Not Pronoun	Tom Clancy or any other serious military strategy analyst	finds	find	Sing	find	ccomp	I honestly wonder what Tom Clancy or any other serious military strategy analyst finds the most insulting about games like CoD now.	c4-train.00001-of-01024_parsed_xac.conllu
SS	False	False	Sing	Not Pronoun	Sing	Not Pronoun	A voiced consonant ( or sound )	means	mean	Sing	mean	root	A voiced consonant (or sound) means that it uses the vocal cords and they produce a vibration or humming sound in the throat when they are said.	c4-train.00001-of-01024_parsed_xac.conllu
UNK	False	False	UNK	2	Sing	Not Pronoun	you or a loved one	needs	need	Sing	need	advcl	If you or a loved one needs assistance in any of the above areas, complete our free case review form today to get in touch with our Newport News accident attorneys.	c4-train.00001-of-01024_parsed_xac.conllu
SS	False	False	Sing	Not Pronoun	Sing	Not Pronoun	Eddie Mair or Martha Kearney	saying	say		say	advcl	Listening to Radio 4 – PM, or especially The World at One – it sometimes seems that every other story ends up with Eddie Mair or Martha Kearney saying “we asked the government for comment but they told us that no one was available”.	c4-train.00001-of-01024_parsed_xac.conllu
PP	False	False	Plur	Not Pronoun	Plur	Not Pronoun	detailed panels or louvered doors in a sturdy hardwood build	add	add	Plur	add	parataxis	Double sink vanity storage enhance the traditional style with a marble sink for a tasteful nod to classic design some models span 100 inches wide to bring hidden linen, makeup and cleaning supply storage to a long wall detailed panels or louvered doors in a sturdy hardwood build add interest, and a toe kick or turned feet can boost charm.	c4-train.00001-of-01024_parsed_xac.conllu
SS	False	False	Sing	3	Sing	3	he or she	is	be	Sing	address	aux	I'm saying that because all open letters begin with this false sense of intimacy and the bogus claim that the writer really wants the best for the person he or she is addressing.	c4-train.00001-of-01024_parsed_xac.conllu
SS	False	False	Sing	Not Pronoun	Sing	Not Pronoun	spending or debt	is	be	Sing	control	cop	If spending or debt is out of control, urge them to take one of the Gift personal finance classes.	c4-train.00001-of-01024_parsed_xac.conllu
SS	False	False	Sing	Not Pronoun	Sing	Not Pronoun	a car or truck	strikes	strike	Sing	strike	advcl	If a car or truck strikes a pedestrian, the pedestrian is likely to die or suffer catastrophic injuries.	c4-train.00001-of-01024_parsed_xac.conllu
SS	False	False	Sing	3	Sing	3	him or her	learn	learn		learn	acl	Whether or not your child grows up to be the next Zuckerberg, programming is a highly useful skill for him or her to learn.	c4-train.00001-of-01024_parsed_xac.conllu
UNK	False	False	UNK	2	Sing	Not Pronoun	you or one family member	is	be	Sing	do	cop	One way around this is for you or one family member to do a forward visit, to check out real estate to see what's on offer and whether anything is a good deal.	c4-train.00001-of-01024_parsed_xac.conllu
SS	False	False	Sing	Not Pronoun	Sing	Not Pronoun	Structure discovery ( or analysis )	helps	help	Sing	help	parataxis	Structure Discovery – Structure discovery (or analysis) helps you determine if your data is consistent and correctly formatted.	c4-train.00001-of-01024_parsed_xac.conllu
PP	False	False	Plur	Not Pronoun	Plur	Not Pronoun	Numerous Yeti Casino reviews or ratings	attest	attest	Plur	attest	root	Numerous Yeti Casino reviews or ratings attest to the fact that the casino assists punters to get settled in quickly, through various ways.	c4-train.00001-of-01024_parsed_xac.conllu
SS	False	False	Sing	Not Pronoun	Sing	Not Pronoun	The flat anti-venom or Ice Age , an Foundational Facebook of projecting and re-parameterizing verification deaths ,	delights	delight	Sing	delight	root	The flat anti-venom or Ice Age, an Foundational Facebook of projecting and re-parameterizing verification deaths, delights filled by convex French books and curve engine lives.	c4-train.00001-of-01024_parsed_xac.conllu
UNK	False	False	UNK	Not Pronoun	Sing	Not Pronoun	" Cold Pressed " or " first cold pressing "	is	be	Sing	label	cop	"Cold Pressed" or "first cold pressing" is now an outdated label.	c4-train.00001-of-01024_parsed_xac.conllu
UNK	False	False	UNK	Not Pronoun	UNK	Not Pronoun	One or all of these stories	is	be	Sing	way	cop	One or all of these stories is a great way to extend the lesson and provide additional learning opportunities to teach preschoolers	c4-train.00001-of-01024_parsed_xac.conllu
SS	False	False	Sing	Not Pronoun	Sing	Not Pronoun	Mustard oil or ghee	gel	gel		gel	ccomp	Mustard oil or ghee gel with Indian delicacies," added Batra, who stressed on the importance of a proper balance of protein, carbohydrates and micronutrients.	c4-train.00001-of-01024_parsed_xac.conllu
SS	False	False	Sing	Not Pronoun	Sing	Not Pronoun	your product or service	works	work	Sing	work	ccomp	Simply put, a case study is a way to prove your product or service works, with factual evidence from your current customers.	c4-train.00001-of-01024_parsed_xac.conllu
PP	False	False	Plur	Not Pronoun	Plur	Not Pronoun	your products or services	have	have	Plur	affect	aux	Case studies explore how your products or services have affected specific customers.	c4-train.00001-of-01024_parsed_xac.conllu
UNK	False	False	UNK	Not Pronoun	Sing	Not Pronoun	written or video	does	do	Sing	have	aux	Still, written or video doesn't have to be an either-or decision.	c4-train.00001-of-01024_parsed_xac.conllu
SS	False	False	Sing	Not Pronoun	Sing	Not Pronoun	our product or service	offers	offer	Sing	offer	acl:relcl	How do you measure the value our product or service offers?	c4-train.00001-of-01024_parsed_xac.conllu
PP	False	False	Plur	Not Pronoun	Plur	Not Pronoun	their products or services	are	be	Plur	be	advcl:relcl	Some B2B companies fall for the temptation to go on and on about how great their products or services are.	c4-train.00001-of-01024_parsed_xac.conllu
SS	False	False	Sing	Not Pronoun	Sing	Not Pronoun	Post - Traumatic Stress Disorder , or PTSD ,	involves	involve	Sing	involve	root	Post-Traumatic Stress Disorder, or PTSD, involves ‘replaying’ unwanted memories, checking for danger, and problems with sleeping.	c4-train.00001-of-01024_parsed_xac.conllu
SS	False	False	Sing	3	Sing	3	he or she	be	be		look	advcl	I personally think he or she looks very regal or royal like a King or a Queen to be!	c4-train.00001-of-01024_parsed_xac.conllu
SS	False	False	Sing	Not Pronoun	Sing	Not Pronoun	Artsakh or Nagorno Karabakh	is	be	Sing	adjunct	cop	Artsakh or Nagorno Karabakh is a landlocked and unrecognized state adjunct to Armenia.	c4-train.00001-of-01024_parsed_xac.conllu
PP	False	False	Plur	Not Pronoun	Plur	Not Pronoun	the volunteers - or council ratepayers -	pay	pay	Plur	pay	csubj	It's not appropriate the volunteers - or council ratepayers - pay for independent expert opinion.	c4-train.00001-of-01024_parsed_xac.conllu
PP	False	False	Plur	Not Pronoun	Plur	Not Pronoun	the volunteers - or council ratepayers -	pay	pay	Plur	pay	csubj	It's not appropriate the volunteers - or council ratepayers - pay for independent expert opinion.	c4-train.00001-of-01024_parsed_xac.conllu
UNK	False	False	UNK	2	Sing	Not Pronoun	you or your child	is	be	Sing	feel	aux	If you or your child is feeling the strain — or you want to make sure you don’t — try these tips.	c4-train.00001-of-01024_parsed_xac.conllu
SS	False	False	Sing	Not Pronoun	Sing	Not Pronoun	a house or an office	is	be	Sing	project	cop	For example, while a house or an office is a large construction project the builder who is in charge of such a project can very well not have the subtle knowledge necessary to build a summer house for your yard.	c4-train.00001-of-01024_parsed_xac.conllu
PP	False	False	Plur	Not Pronoun	Plur	Not Personal Pronoun	Players on black market sites or those who wager through independent bookies	have	have	Plur	have	root	Players on black market sites or those who wager through independent bookies have no such assurances.	c4-train.00001-of-01024_parsed_xac.conllu
PP	False	False	Plur	Not Pronoun	Plur	Not Pronoun	Public clinics or health departments offering free STD testing in Colorado Springs	provide	provide	Plur	provide	root	Public clinics or health departments offering free STD testing in Colorado Springs provide little privacy when it comes to your sexual health.	c4-train.00001-of-01024_parsed_xac.conllu
PP	False	False	Plur	Not Pronoun	Plur	Not Pronoun	colors or smells	are	be	Plur	brain	cop	Brains may be about smells or colors, but colors or smells aren’t about brains.	c4-train.00001-of-01024_parsed_xac.conllu
SS	False	False	Sing	3	Sing	3	he or she	wants	want	Sing	want	acl:relcl	Offering a compromise that gives nothing to the customer that he or she wants is likely to make them angrier, because it shows you aren't listening, or making an effort to understand.	c4-train.00001-of-01024_parsed_xac.conllu
SP	False	False	Sing	Not Pronoun	Plur	Not Pronoun	Harold Ndlovu or ‘ sticks ’ as he is affectionately known in the sporting fraternity	is	be	Sing	footballer	cop	Harold Ndlovu or ‘sticks’ as he is affectionately known in the sporting fraternity is a Limpopo born footballer who at a tender age knew that soccer was a sport he wanted to take professionally.	c4-train.00001-of-01024_parsed_xac.conllu
