experiment_condition	has_either	has_neither	conj_1_number	conj_1_person	conj_2_number	conj_2_person	nsubj	verb_form	verb_lemma	verb_number	main_predicate_lemma	main_predicate_arc	sentence	filename
SS	False	False	Sing	Not Pronoun	Sing	Not Pronoun	The Pacific Asia Travel Association or PATA that promotes the responsible development of travel and tourism	has	have	Sing	award	aux	The Pacific Asia Travel Association or PATA that promotes the responsible development of travel and tourism has awarded 15 individuals and organisations for their outstanding contributions to the tourism sector.	c4-train.00001-of-01024_parsed_xaa.conllu
UNK	False	False	UNK	Not Pronoun	UNK	Not Pronoun	some or all of us	head	head	Plur	head	root	After rehearsals, some or all of us usually head to a local café for drinks and eats.	c4-train.00001-of-01024_parsed_xaa.conllu
SS	False	False	Sing	Not Pronoun	Sing	Not Pronoun	a particular day or date in 2018	takes	take	Sing	take	advcl	You might also use this site to look out when a particular day or date in 2018 takes place.	c4-train.00001-of-01024_parsed_xaa.conllu
SS	False	False	Sing	Not Pronoun	Sing	Not Pronoun	a hospital or physician	making	make		make	advcl	Instead of a hospital or physician making money based on treating sick people, Kaiser actually makes more money if they can prevent you from getting sick in the first place.	c4-train.00001-of-01024_parsed_xaa.conllu
SS	False	False	Sing	Not Pronoun	Sing	Not Pronoun	" DRG " or District Reference Group -- often pronounced " dirg " --	is	be	Sing	grouping	cop	"DRG" or District Reference Group -- often pronounced "dirg" -- is grouping of schools based on the town's wealth and student need.	c4-train.00001-of-01024_parsed_xaa.conllu
SS	False	False	Sing	Not Pronoun	Sing	Not Pronoun	a Far Cry spin - off or perhaps sequel	seems	seem	Sing	seem	root	So yeah, a Far Cry spin-off or perhaps sequel seems to be on the horizon.	c4-train.00001-of-01024_parsed_xaa.conllu
SS	False	False	Sing	Not Pronoun	Sing	Not Pronoun	No Refund or replace	applies	apply	Sing	apply	root	No Refund or replace applies to this purchase as this is a service.	c4-train.00001-of-01024_parsed_xaa.conllu
SS	False	False	Sing	Not Pronoun	Sing	Not Pronoun	An I.T. closet or wiring closet	is	be	Sing	room	cop	An I.T. closet or wiring closet is a small room found in commercial buildings for all electrical connections.	c4-train.00001-of-01024_parsed_xaa.conllu
SS	False	False	Sing	Not Pronoun	Sing	Not Pronoun	each desk or seat	gets	get	Sing	get	root	In most instances each desk or seat gets 1 to 3 ports which then covers your; Computer, VOIP Phone, and perhaps a network device such as a Drive or Printer.	c4-train.00001-of-01024_parsed_xaa.conllu
SS	False	False	Sing	Not Pronoun	Sing	Not Pronoun	Mr. Link , or Susan as he renames himself in our film ,	is	be	Sing	Watson	cop	If Sir Lionel is a nod to Sherlock Holmes, then Mr. Link, or Susan as he renames himself in our film, is his very hairy Watson.	c4-train.00001-of-01024_parsed_xaa.conllu
SS	False	False	Sing	Not Pronoun	Sing	Not Pronoun	how humanity or lack of	molds	mold	Sing	mold	conj	We are born with a blank slate and what happens after that how humanity or lack of molds that innocent child.	c4-train.00001-of-01024_parsed_xaa.conllu
SS	False	False	Sing	Not Pronoun	Sing	Not Pronoun	a sturdy steel log rack , or perhaps a log rack cover ( or other accessory )	is	be	Sing	way	cop	If he already has a fire pit, a sturdy steel log rack, or perhaps a log rack cover (or other accessory), is the way to go.	c4-train.00001-of-01024_parsed_xaa.conllu
SS	False	False	Sing	Not Pronoun	Sing	Not Pronoun	a Company or establishment	loses	lose	Sing	lose	conj	In case a Director or Manager of a Company forfeit such conditions, or if a Company or establishment loses Icelandic domicile, the party concerned shall have brought the matter into lawful order within 3 months as of the time the change occurred or else he has forfeited his licence.	c4-train.00001-of-01024_parsed_xaa.conllu
SS	False	False	Sing	Not Pronoun	Sing	Not Pronoun	a Director or Manager of a Company	forfeit	forfeit		forfeit	advcl	In case a Director or Manager of a Company forfeit such conditions, or if a Company or establishment loses Icelandic domicile, the party concerned shall have brought the matter into lawful order within 3 months as of the time the change occurred or else he has forfeited his licence.	c4-train.00001-of-01024_parsed_xaa.conllu
SS	False	False	Sing	Not Pronoun	Sing	Not Pronoun	a person or a firm	takes	take	Sing	take	root	5. If a person or a firm takes apprentices for practical training although he be not entitled to do so or takes apprentices for studying another trade than the one in which he is Master or keeps apprentices without a lawful contract.	c4-train.00001-of-01024_parsed_xaa.conllu
SS	False	False	Sing	Not Pronoun	Sing	Not Pronoun	Counseling or coaching	is	be	Sing	strategy	cop	Counseling or coaching is a more up to date strategy to finding an impeccable job.	c4-train.00001-of-01024_parsed_xaa.conllu
SS	False	False	Sing	Not Pronoun	Sing	Not Pronoun	A mentor or career counselor	encourages	encourage	Sing	encourage	root	A mentor or career counselor encourages you to progress; they will suggest a number of choices that you might not have thought of.	c4-train.00001-of-01024_parsed_xaa.conllu
PS	False	False	Plur	Not Pronoun	Sing	Not Pronoun	environmentalists or Citizen John or Jane	question	question		question	csubj	It is natural and right for environmentalists or Citizen John or Jane to question whether the benefits will outweigh the negative and it is responsible to proposed alternative sites.	c4-train.00001-of-01024_parsed_xaa.conllu
SS	False	False	Sing	3	Sing	3	he or she	wants	want	Sing	want	root	When the opponent is able to get the function, he or she wants to return the ball to the other side before the ball bounces on her or his side another time.	c4-train.00001-of-01024_parsed_xaa.conllu
SS	False	False	Sing	Not Pronoun	Sing	Not Pronoun	a violation or dangerous emission	has	have	Sing	occur	aux	Sites listed below indicate they are registered as places subject to environmental regulation or of environmental interest and do not independently mean that a violation or dangerous emission has occurred.	c4-train.00001-of-01024_parsed_xaa.conllu
SS	False	False	Sing	Not Pronoun	Sing	Not Pronoun	the fire department or other local fire control agency	makes	make	Sing	make	acl	A. At such times as the fire department or other local fire control agency makes routine or other fire inspections within the City, it shall also be the duty of the fire department to inspect all such inspected premises to assure compliance with the requirements for placing and maintaining litter receptacles as required by this chapter.	c4-train.00001-of-01024_parsed_xaa.conllu
SS	False	False	Sing	Not Pronoun	Sing	Not Pronoun	the trim lever or wheel	trims	trim	Sing	trim	conj	There is no trim tab & the trim lever or wheel trims the entire stabilator.	c4-train.00001-of-01024_parsed_xaa.conllu
PS	False	False	Plur	Not Pronoun	Sing	Not Pronoun	A Carabiners or karabiner	is	be	Sing	type	cop	A Carabiners or karabiner is a specialized type of shackle, a metal loop with a spring-loaded gate used to quickly and reversibly connect components, most notably in safety-critical systems.	c4-train.00001-of-01024_parsed_xaa.conllu
SS	False	False	Sing	Not Pronoun	Sing	Not Pronoun	The term ‘ Defective Product ’ , or a case against a manufacturer for ‘ Product Liability ’	brings	bring	Sing	bring	root	The term ‘Defective Product’, or a case against a manufacturer for ‘Product Liability’ often brings to mind dangerous products.	c4-train.00001-of-01024_parsed_xaa.conllu
PP	False	False	Plur	Not Pronoun	Plur	Not Pronoun	Child door bouncers , or jumpers ,	consist	consist	Plur	consist	root	Child door bouncers, or jumpers, consist of a seat hooked up to stretchy, bungee-like cords that clamp to the top of a doorway.	c4-train.00001-of-01024_parsed_xaa.conllu
SS	False	False	Sing	3	Sing	3	he or she	is	be	Sing	attempt	aux	When your baby looks like he or she is attempting to roll over, you need to stop swaddling.	c4-train.00001-of-01024_parsed_xaa.conllu
PP	False	False	Plur	Not Pronoun	Plur	Not Pronoun	Scammers or Spammers	surface	surface	Plur	surface	advcl	It doesn't happen often, but when Scammers or Spammers surface they can be quickly reported by our community.	c4-train.00001-of-01024_parsed_xaa.conllu
PS	False	False	Plur	Not Pronoun	Sing	Not Pronoun	cold spots or wind	come	come		come	acl	Dressing up is OK, I didn’t particularly enjoy that the zipper was not going down one of the legs which would have made dressing up easier, but I guess that would have created more possibilities for cold spots or wind to come in.	c4-train.00001-of-01024_parsed_xaa.conllu
PP	False	False	Plur	Not Pronoun	Plur	Not Pronoun	Face filters or AI lenses	are	be	Plur	go	aux	Face filters or AI lenses are going to be popular in 2018 as well.	c4-train.00001-of-01024_parsed_xaa.conllu
SS	False	False	Sing	3	Sing	3	he or she	is	be	Sing	beneficiary	cop	Slabbert says that according to law, a person as young as 14-years old qualifies to sign as a witness, provided that he or she is not a beneficiary of the estate.	c4-train.00001-of-01024_parsed_xaa.conllu
SS	False	False	Sing	Not Pronoun	Sing	Not Pronoun	your puppy or dog	is	be	Sing	respond	aux	If your puppy or dog is not responding to the training or at any time regresses in their house training, please see your veterinarian for a possible health related issue.	c4-train.00001-of-01024_parsed_xaa.conllu
PP	False	False	Plur	Not Pronoun	Plur	Not Pronoun	the slow brainwaves or oscillations	represent	represent	Plur	represent	root	In tennis lingo, for example, the slow brainwaves or oscillations represent the ball toss while the spindles symbolize the swing of the racket as it aims to make contact with the ball and serve an ace.	c4-train.00001-of-01024_parsed_xaa.conllu
SS	False	False	Sing	Not Pronoun	Sing	Not Pronoun	your voluntary use of or participation in a co-branded service or feature	means	mean	Sing	mean	conj	We may share your Personal Information with our Co-Branded Partner and your voluntary use of or participation in a co-branded service or feature means that you opt-in and give your affirmative consent to both iThentic and our Co-Branded Partner to collect and use your Personal Information provided during the Registered User registration process and/or in connection with the specific co-branded feature or service for the fulfillment of the feature or service and for marketing or administrative purposes.	c4-train.00001-of-01024_parsed_xaa.conllu
PP	False	False	Plur	1	Plur	Not Pronoun	we or other businesses	have	have	Plur	collect	aux	If so, personal and non-personal information that we or other businesses have collected will likely be transferred as part of the transaction.	c4-train.00001-of-01024_parsed_xaa.conllu
SS	False	False	Sing	3	Sing	3	he or she	has	have	Sing	have	ccomp	If you do decide to use the services of a professional wedding planner to choose your Las Vegas cakes, be sure that he or she has a clear understanding of not only your tastes but your budget as well.	c4-train.00001-of-01024_parsed_xaa.conllu
UNK	False	False	Sing	Not Pronoun	UNK	Not Pronoun	Bathroom remodeling , or updating our ideas in bathroom decor	is	be	Sing	way	cop	Bathroom remodeling, or updating our ideas in bathroom decor is an effective way to add worth to your home since it is the second most popular remodeling mission for homes.	c4-train.00001-of-01024_parsed_xaa.conllu
PS	False	False	Plur	Not Pronoun	Sing	Not Pronoun	rips or rain	ruining	ruin		ruin	advcl	The travel wallet protects the notebook against the elements and abrasion, so you don’t need to worry about rips or rain ruining your important notes.	c4-train.00001-of-01024_parsed_xaa.conllu
PP	False	False	Plur	Not Pronoun	Plur	Not Pronoun	Descriptions of , or references to any third party products , services , publications , or any hyperlinks to other websites within BridgeTrustTitle.com web sites	does	do	Sing	imply	aux	Descriptions of, or references to any third party products, services, publications, or any hyperlinks to other websites within BridgeTrustTitle.com web sites does not imply endorsement of that product, service, publication or company, and does not necessarily represent the views or opinions of BridgeTrustTitle.com.	c4-train.00001-of-01024_parsed_xaa.conllu
SS	False	False	Sing	Not Pronoun	Sing	Not Pronoun	the cowboy or animal	has	have	Sing	do	aux	He must mark the ride on exactly what happened, not what the cowboy or animal has done in the past.	c4-train.00001-of-01024_parsed_xaa.conllu
PS	False	False	Plur	Not Pronoun	Sing	Not Pronoun	Obama supporters and / or left - leaning group	listen	listen	Plur	listen	advcl	When Obama supporters and/or left-leaning group listen to this statement, they hear a criminal incitement against a Democratic president.	c4-train.00001-of-01024_parsed_xaa.conllu
PP	False	False	Plur	Not Pronoun	Plur	Not Pronoun	Some staff or operational units	prefer	prefer	Plur	prefer	root	Some staff or operational units prefer to stick to their old processes and procedures even when the shortcomings of these approaches are recognised.	c4-train.00001-of-01024_parsed_xaa.conllu
PP	False	False	Plur	Not Pronoun	Plur	Not Pronoun	some cheap beds or cots	are	be	Plur	order	cop	You need a comfortable place to sleep, so some cheap beds or cots are in order.	c4-train.00001-of-01024_parsed_xaa.conllu
SS	False	False	Sing	Not Pronoun	Sing	Not Pronoun	MyRA or My Recruitment Assistant	is	be	Sing	system	cop	MyRA or My Recruitment Assistant is your online applicant tracking system for your recruitment business.	c4-train.00001-of-01024_parsed_xaa.conllu
UNK	False	False	UNK	2	Sing	Not Pronoun	you or your staff	use	use		use	ccomp	Whether you require a format for Microsoft Office Applications, or you need to replicate a pdf – we make sure the template is easy for you or your staff to use.	c4-train.00001-of-01024_parsed_xaa.conllu
SS	False	False	Sing	Not Pronoun	Sing	Not Pronoun	a bar or kitchen island	is	be	Sing	must	cop	For any contemporary kitchen to really make a statement, a bar or kitchen island is a must.	c4-train.00001-of-01024_parsed_xaa.conllu
SP	False	False	Sing	Not Pronoun	Plur	Not Pronoun	a walk / run 5 k or other outdoor activities	are	be	Plur	way	cop	If you’re looking for ways to burn off some of the extra stuffing consumed during the thanksgiving feast, a walk/run 5k or other outdoor activities are perfect ways to keep your body moving during this holiday rest.	c4-train.00001-of-01024_parsed_xaa.conllu
SS	False	False	Sing	3	Sing	3	he or she	does	do	Sing	follow	aux	That's because a trust is a binding legal contract, and your trustee can be held liable if he or she doesn't follow your instructions.	c4-train.00001-of-01024_parsed_xaa.conllu
SS	False	False	Sing	Not Pronoun	Sing	Not Pronoun	a bank or trust company	fails	fail	Sing	fail	advcl	Even if a bank or trust company fails, trust assets are safe.	c4-train.00001-of-01024_parsed_xaa.conllu
SS	False	False	Sing	Not Pronoun	Sing	Not Pronoun	a fiduciary or other responsible person	steals	steal	Sing	steal	acl:relcl	A bond designed to protect a retirement plan’s participants in the event a fiduciary or other responsible person steals or mishandles plan assets.	c4-train.00001-of-01024_parsed_xaa.conllu
SS	False	False	Sing	3	Sing	3	he or she	has	have	Sing	attend	aux	If a student completely withdraws from all classes prior to the 60% point of the semester, he or she is required by federal regulations to repay the funds for the time he or she has not attended class.	c4-train.00001-of-01024_parsed_xaa.conllu
SS	False	False	Sing	Not Pronoun	Sing	Not Pronoun	your son or daughter	is	be	Sing	control	cop	If your son or daughter is out of control, he or she needs you to intervene.	c4-train.00001-of-01024_parsed_xaa.conllu
SS	False	False	Sing	3	Sing	3	he or she	needs	need	Sing	need	root	If your son or daughter is out of control, he or she needs you to intervene.	c4-train.00001-of-01024_parsed_xaa.conllu
SS	False	False	Sing	3	Sing	3	he or she	needs	need	Sing	need	acl:relcl	Use our expertise to help you find a Christian boarding school closest to Helotes, Texas that will provide your teen with the help and mentoring he or she needs, and within your budget.	c4-train.00001-of-01024_parsed_xaa.conllu
SS	False	False	Sing	Not Pronoun	Sing	Not Pronoun	a school or organization	invests	invest	Sing	invest	csubj	It is advisable that a school or organization invests in a voltage stabilizer and/or inverter if there is a known problem with electricity or power supply.	c4-train.00001-of-01024_parsed_xaa.conllu
PS	False	False	Plur	3	Sing	Not Pronoun	they or their company	do	do	Plur	do	acl:relcl	Each attendee is asked to tell the group who they are, what they or their company do, and at that time can quickly pass around any additional materials that augment their introduction.	c4-train.00001-of-01024_parsed_xaa.conllu
SS	False	False	Sing	Not Pronoun	Sing	Not Pronoun	HIV or Human Immunodeficiency Virus	is	be	Sing	lentivirus	cop	HIV or Human Immunodeficiency Virus is a lentivirus (a subgroup of retrovirus) that causes HIV infection and over time acquired immunodeficiency syndrome (AIDS) (see Wikipedia) .	c4-train.00001-of-01024_parsed_xaa.conllu
PP	False	False	Plur	Not Pronoun	Plur	Not Pronoun	your hidden motives or expectations	are	be	Plur	what	cop	What are your hidden motives or expectations?	c4-train.00001-of-01024_parsed_xaa.conllu
SS	False	False	Sing	Not Pronoun	Sing	Not Pronoun	Povitica , or Croatian walnut bread ,	is	be	Sing	favorite	cop	Povitica, or Croatian walnut bread, is a nostalgic favorite of many Eastern Europeans and their descendants.	c4-train.00001-of-01024_parsed_xaa.conllu
PP	False	False	Plur	Not Pronoun	Plur	Not Pronoun	the authorities or ticketing agents	take	take		take	ccomp	I am hoping for the authorities or ticketing agents to take actions avian at these scalpers.	c4-train.00001-of-01024_parsed_xaa.conllu
PS	False	False	Plur	Not Pronoun	Sing	Not Pronoun	no injuries or property damage	has	have	Sing	result	aux	Four consumer complaints have been filed but no injuries or property damage has resulted so far.	c4-train.00001-of-01024_parsed_xaa.conllu
SS	False	False	Sing	3	Sing	3	he or she	like	like		like	acl	If you just seem to get a good grasp on what he or she valor like in a wine gift shopping basket then get a international wine gift carrier.	c4-train.00001-of-01024_parsed_xaa.conllu
SS	False	False	Sing	Not Pronoun	Sing	Not Pronoun	The possibility of winning or the excitement of coming to a spend limit to win an unconditional present	brings	bring	Sing	bring	root	The possibility of winning or the excitement of coming to a spend limit to win an unconditional present brings the component of play or rivalry, which is a solid main thrust for obtaining.	c4-train.00001-of-01024_parsed_xaa.conllu
SS	False	False	Sing	Not Pronoun	Sing	Not Pronoun	a rider ’s address or name	changes	change	Sing	change	advcl	If a rider’s address or name changes, the rider should contact Green Bay Metro to update this information.	c4-train.00001-of-01024_parsed_xaa.conllu
SS	False	False	Sing	Not Pronoun	Sing	Not Pronoun	the lift or the vehicle	is	be	Sing	motion	cop	Due to the high center of gravity of scooter-type mobility aids and the recommendation by scooter manufacturers, Green Bay Metro recommends that riders not be seated on the scooter either while the lift or the vehicle is in motion.	c4-train.00001-of-01024_parsed_xaa.conllu
SS	False	False	Sing	Not Pronoun	Sing	Not Pronoun	A day out or even a short trip to the grocery store	requires	require	Sing	require	root	A day out or even a short trip to the grocery store requires a little planning and a lot of preparation.	c4-train.00001-of-01024_parsed_xaa.conllu
SS	False	False	Sing	Not Pronoun	Sing	Not Pronoun	milk or formula	has	have	Sing	have	advcl	Your baby is now getting more nutrition and vitamins than milk or formula has to offer.	c4-train.00001-of-01024_parsed_xaa.conllu
PP	False	False	Plur	Not Pronoun	Plur	Not Pronoun	Our Shampoos or Leave - In Conditioning Sprays	DO	do	Plur	contain	aux	No. Our Shampoos or Leave-In Conditioning Sprays DO NOT contain parabens, sulfates, phosphates or other harsh chemical ingredients.	c4-train.00001-of-01024_parsed_xaa.conllu
SS	False	False	Sing	Not Pronoun	Sing	Not Pronoun	repression or transcription of structural genes	occur	occur	Plur	occur	acl:relcl	Operon consists of structural genes and the promoter where in the presence of co repressor repression or transcription of structural genes occur and in the absence of the latter transcription of structural genes occur.	c4-train.00001-of-01024_parsed_xaa.conllu
SS	False	False	Sing	Not Pronoun	Sing	Not Pronoun	your factory or garage	is	be	Sing	use	aux	If you are doing so, then you have to require certificates from the authorities that state your factory or garage is to use again.	c4-train.00001-of-01024_parsed_xaa.conllu
SS	False	False	Sing	Not Pronoun	Sing	Not Pronoun	Coffee or tea on your deck greeted by the morning sun and million dollar view	brings	bring	Sing	bring	root	Coffee or tea on your deck greeted by the morning sun and million dollar view brings a smile ear to ear and is your reward for working hard all year!	c4-train.00001-of-01024_parsed_xaa.conllu
PP	False	False	Plur	Not Pronoun	Plur	Not Pronoun	Straight legged , shorts or skirts with frill , holes or a ripped up appeal	is	be	Sing	look	cop	Straight legged, shorts or skirts with frill, holes or a ripped up appeal is a great look for summer.	c4-train.00001-of-01024_parsed_xaa.conllu
SS	False	False	Sing	Not Pronoun	Sing	Not Pronoun	a leaky copper pipe or dripping tap	does	do	Sing	let	aux	If around midnight or in the time of the school holidays a leaky copper pipe or dripping tap does not let you sleep, call us as we are open Twenty-four hours a day seven days a week in Sutton SM5.	c4-train.00001-of-01024_parsed_xaa.conllu
SS	False	False	Sing	Not Pronoun	Sing	Not Pronoun	your son or daughter	is	be	Sing	play	aux	And all because your son or daughter isn't playing."	c4-train.00001-of-01024_parsed_xaa.conllu
SS	False	False	Sing	Not Pronoun	Sing	Not Pronoun	anxiety or worry	kicks	kick	Sing	kick	advcl	When anxiety or worry kicks in, we often end up feeling the effect of it.	c4-train.00001-of-01024_parsed_xaa.conllu
SS	False	False	Sing	3	Sing	3	he or she	outgrows	outgrow	Sing	outgrow	advcl	A number of treatment approaches can help your child stay dry until he or she outgrows the problem.	c4-train.00001-of-01024_parsed_xaa.conllu
SS	False	False	Sing	Not Pronoun	Sing	Not Pronoun	an American town or city	drops	drop	Sing	drop	acl	It seems as though every time an American town or city drops the added fluoride chemicals from its water supply, the dinosaur media comes out with its usual talking points about how water fluoridation is one of the greatest public health interventions ever granted by the government to its minions, and that without added fluoride chemicals, everyone’s teeth would rot right out of their heads.	c4-train.00001-of-01024_parsed_xaa.conllu
SS	False	False	Sing	3	Sing	3	He or she	goes	go	Sing	go	root	He or she then goes on to say that cities that fluoridate their water supplies are simply topping off fluoride levels to reach this so-called “optimal” range, making no differentiation between natural fluoride and chemical fluorides like hexafluorosilicic acid and sodium hexafluorosilicate.	c4-train.00001-of-01024_parsed_xaa.conllu
SS	False	False	Sing	Not Pronoun	Sing	Not Pronoun	Almost every jeweller or jewellery student	has	have	Sing	work	aux	Almost every jeweller or jewellery student has worked on earrings at some point.	c4-train.00001-of-01024_parsed_xaa.conllu
UNK	False	False	UNK	2	Sing	Not Pronoun	you or your family member	wishes	wish	Sing	wish	advcl	*If you or your family member wishes to use your own physician, he/she will need to be credentialed through the facility.	c4-train.00001-of-01024_parsed_xaa.conllu
SS	False	False	Sing	3	Sing	3	he or she	makes	make	Sing	make	advcl	The technician will ask your permission before he or she makes any changes to your machine.	c4-train.00001-of-01024_parsed_xaa.conllu
SS	False	False	Sing	Not Pronoun	Sing	Not Pronoun	IPL or intense pulsed light laser therapy	is	be	Sing	form	cop	IPL or intense pulsed light laser therapy is a form of skin resurfacing developed to improve the appearance of skin while reducing the signs of aging.	c4-train.00001-of-01024_parsed_xaa.conllu
SS	False	False	Sing	Not Pronoun	Sing	Not Pronoun	a break or a sprain	heals	heal	Sing	heal	advcl	I refuse to be one of those people who's driven to work every day while a break or a sprain heals.	c4-train.00001-of-01024_parsed_xaa.conllu
SS	False	False	Sing	Not Pronoun	Sing	Not Pronoun	your business or brand	needs	need	Sing	need	acl:relcl	So you finally created the website that your business or brand needs to market globally, but nobody is clicking on your site and the phone never rings.	c4-train.00001-of-01024_parsed_xaa.conllu
SS	False	False	Sing	Not Pronoun	Sing	Not Pronoun	my dog or cat	requires	require	Sing	require	advcl	How do I know when my dog or cat requires treatment?	c4-train.00001-of-01024_parsed_xaa.conllu
SS	False	False	Sing	Not Pronoun	Sing	Not Pronoun	your product or service	requires	require	Sing	require	advcl	Additionally, if your product or service requires in-depth technical training, or if telemarketers will need direct communication with decision makers, in-house makes sense.	c4-train.00001-of-01024_parsed_xaa.conllu
SS	False	False	Sing	Not Pronoun	Sing	Not Pronoun	your home or business	has	have	Sing	have	ccomp	If you suspect that your home or business has a mold problem, SERVPRO of Scripps Ranch / Mira Mesa / Rancho Penasquitos has the training, equipment, and expertise to handle the situation.	c4-train.00001-of-01024_parsed_xaa.conllu
