experiment_condition	has_either	has_neither	conj_1_number	conj_1_person	conj_2_number	conj_2_person	nsubj	verb_form	verb_lemma	verb_number	main_predicate_lemma	main_predicate_arc	sentence	filename
UNK	False	False	Sing	Not Pronoun	UNK	Not Pronoun	The very first aspect or I would call it the baby step you need to indulge into	is	be	Sing	Strategy	cop	The very first aspect or I would call it the baby step you need to indulge into is the Strategy for your content marketing, which is nothing but a ruckus of words if there is no answer to ‘why’ & ‘how’.	c4-train.00001-of-01024_parsed_xac.conllu
SS	False	False	Sing	Not Pronoun	Sing	Not Pronoun	your condition or injury	is	be	Sing	stage	cop	However if your condition or injury is now at that stage, you have found a surgeon to replace your worn-out knees or hips, or to repair that torn cartilage, you’ve scheduled your operation, had your pre – op assessment, read all you can and talked to others who have gone before you but still, you may feel trepidation.	c4-train.00001-of-01024_parsed_xac.conllu
SS	False	False	Sing	Not Pronoun	Sing	Not Pronoun	A swamped cellar or storm condition	occurs	occur	Sing	occur	root	A swamped cellar or storm condition never occurs at a good time.	c4-train.00001-of-01024_parsed_xac.conllu
UNK	False	False	UNK	Not Pronoun	UNK	Not Pronoun	how many , or rather how few , of us	appreciate	appreciate	Plur	appreciate	ccomp	I wonder how many, or rather how few, of us appreciate Paul’s imprisonment and sufferings for us.	c4-train.00001-of-01024_parsed_xac.conllu
SS	False	False	Sing	Not Pronoun	Sing	Not Pronoun	Ooty , or Udhagamandalam ,	is	be	Sing	station	cop	Ooty: Ooty, or Udhagamandalam, is a hill station in the Niligri hills with a steam-driven narrow gauge train going up to it.	c4-train.00001-of-01024_parsed_xac.conllu
SS	False	False	Sing	Not Pronoun	Sing	Not Pronoun	Ecommerce or electronic commerce	refers	refer	Sing	refer	root	After they teach the maltha coram the cohomology (popof Ecommerce Dissertation Topics Introduction Ecommerce or electronic commerce refers to the online trade of services and products.	c4-train.00001-of-01024_parsed_xac.conllu
SS	False	False	Sing	Not Pronoun	Sing	Not Pronoun	no man or woman	has	have	Sing	go	aux	But that’s the American Way to keep improving ourselves beyond a survivability viewpoint and to accelerate into the future where no man or woman has gone.	c4-train.00001-of-01024_parsed_xac.conllu
PS	False	False	Plur	Not Pronoun	Sing	Not Pronoun	the oral medicines you 've taken or the injection ( s ) you 've been given	has	have	Sing	help	aux	The GP or community nurse who gives you any of the ‘Just in Case’ medicines will assess you to see if the oral medicines you've taken or the injection(s) you've been given has helped.	c4-train.00001-of-01024_parsed_xac.conllu
UNK	False	False	UNK	2	Sing	Not Pronoun	you or your carer	is	be	Sing	administer	aux	If you or your carer is administering the ‘Just in Case’ medicines you will have a plan available in your house about your care with instructions on what you should do if you have to give the medicines.	c4-train.00001-of-01024_parsed_xac.conllu
PP	False	False	Plur	Not Pronoun	Plur	Not Pronoun	your children or teenagers	are	be	Plur	use	aux	If your children or teenagers are using this medicine it is essential to conduct regular x-rays to check for bone growth.	c4-train.00001-of-01024_parsed_xac.conllu
SP	False	False	Sing	Not Pronoun	Plur	Not Pronoun	the window or ContactID data	unbound	unbound	Sing	unbound	root	sample data the window or ContactID data you unbound when you Please called the caption.	c4-train.00001-of-01024_parsed_xac.conllu
UNK	False	False	UNK	2	Sing	Not Pronoun	you and / or your company / organisation	are	be	Sing	look	aux	If you and/or your company/organisation are looking for facilities like Ask Retreat Centre it is possible to hire/rent the place.	c4-train.00001-of-01024_parsed_xac.conllu
SS	False	False	Sing	Not Pronoun	Sing	Not Pronoun	whose larva or maggot	destroys	destroy	Sing	destroy	acl:relcl	b - A small fly (Anthomyia ze) whose larva or maggot destroys seed corn after it has been planted.	c4-train.00001-of-01024_parsed_xac.conllu
PP	False	False	Plur	Not Pronoun	Plur	Not Pronoun	high school business classes or university career centers	are	be	Plur	teach	aux	I'm not sure what high school business classes or university career centers are teaching kids these days, but I see some lazy, boring, and sometimes downright awful approaches to pursuing job openings.	c4-train.00001-of-01024_parsed_xac.conllu
SS	False	False	Sing	Not Pronoun	Sing	Not Pronoun	your car or truck	is	be	Sing	perform	aux	We will never use parts that do not exactly match your car’s original parts and ensure your car or truck is performing to standard.	c4-train.00001-of-01024_parsed_xac.conllu
SP	False	False	Sing	Not Pronoun	Plur	Not Pronoun	the reviewer or their readers	considering	consider		consider	acl	I get frustrated by this too, but at the same time, I think it's worth keeping in mind that sometimes more information about the build is omitted for other reasons than the reviewer or their readers not considering it noteworthy.	c4-train.00001-of-01024_parsed_xac.conllu
SP	False	False	Sing	Not Pronoun	Plur	Not Pronoun	literally every statement ever made about the dangers of frivolously introducing new elements , or the difficult judgment calls about which are most useful or necessary and how much of a budget can be assigned to any given theme	are	be	Plur	lie	cop	But I guess because you're some kind of brain genius and expert on all things related to manufacturing, you know your speculation about what stuff should cost LEGO internally is infallible, and thus that literally every statement ever made about the dangers of frivolously introducing new elements, or the difficult judgment calls about which are most useful or necessary and how much of a budget can be assigned to any given theme, are all lies.	c4-train.00001-of-01024_parsed_xac.conllu
PS	False	False	Plur	Not Pronoun	Sing	Not Pronoun	any renovations or new building and commercial operations of the Surf Club	meets	meet	Sing	meet	ccomp	Lets hope this time that any renovations or new building and commercial operations of the Surf Club better meets the needs of the Surf club and the public.	c4-train.00001-of-01024_parsed_xac.conllu
SS	False	False	Sing	Not Pronoun	Sing	Not Pronoun	Your child ’s Bar Mitzvah or Bat Mitzvah	is	be	Sing	celebration	cop	Your child’s Bar Mitzvah or Bat Mitzvah is a once-in-a-lifetime celebration.	c4-train.00001-of-01024_parsed_xac.conllu
SS	False	False	Sing	Not Pronoun	Sing	Not Pronoun	brain injury or any brain illness	affects	affect	Sing	affect	ccomp	We recognize that brain injury or any brain illness affects the whole family.	c4-train.00001-of-01024_parsed_xac.conllu
UNK	False	False	UNK	2	Sing	Not Personal Pronoun	you or anyone you know	is	be	Sing	look	aux	If you or anyone you know is looking to buy a fixer upper in these areas, please tell them to contact us at fixerupperinfo@gmail.com.	c4-train.00001-of-01024_parsed_xac.conllu
SS	False	False	Sing	Not Pronoun	Sing	Not Pronoun	your business card or nameplate	is	be	Sing	what	cop	After all, your business card or nameplate is what decides your value and position in the company.	c4-train.00001-of-01024_parsed_xac.conllu
UNK	False	False	UNK	2	Sing	Not Pronoun	you or your spouse	have	have	Sing	have	advcl	If you or your spouse have less than perfect credit, the partner with the healthier credit score should apply for any loans you need.	c4-train.00001-of-01024_parsed_xac.conllu
SS	False	False	Sing	3	Sing	3	he or she	does	do	Sing	believe	aux	Continue to intercede for and bless your even if he or she does not believe in Jesus.	c4-train.00001-of-01024_parsed_xac.conllu
SS	False	False	Sing	Not Pronoun	Sing	Not Pronoun	this person ( or couple )	does	do	Sing	seem	aux	By that I primarily mean, does this person (or couple) seem to be someone with whom I can effectively communicate?	c4-train.00001-of-01024_parsed_xac.conllu
UNK	False	False	UNK	2	Sing	Not Personal Pronoun	you or someone you know	find	find	Sing	find	advcl	If you or someone you know find this information helpful please like and share using the social media buttons below.	c4-train.00001-of-01024_parsed_xac.conllu
UNK	False	False	UNK	2	Sing	Not Pronoun	you or a loved one	has	have	Sing	suffer	aux	If you or a loved one has suffered an amputation due to someone else’s negligence, you may be eligible for compensation.	c4-train.00001-of-01024_parsed_xac.conllu
UNK	False	False	UNK	Not Pronoun	UNK	Not Pronoun	neither or both	is	be	Sing	what	cop	But, likely neither or both is what is happening in her fiction and graphic novel work..	c4-train.00001-of-01024_parsed_xac.conllu
SS	False	False	Sing	Not Pronoun	Sing	Not Pronoun	black , or darkness ,	is	be	Sing	absent	cop	Meanwhile, black, or darkness, is the absent of any colors of the light spectrum.	c4-train.00001-of-01024_parsed_xac.conllu
SS	False	False	Sing	Not Pronoun	Sing	Not Pronoun	misunderstanding or a weakening of expression	results	result	Sing	result	advcl	It is very important that you can see every single change made to paragraphs, sentences and words, everything added or deleted as well, because misunderstanding or a weakening of expression often results from the editing and proofreading process.	c4-train.00001-of-01024_parsed_xac.conllu
SS	False	False	Sing	Not Pronoun	Sing	Not Pronoun	This article or section	does	do	Sing	match	aux	This article or section does not match our manual of style or needs other editing.	c4-train.00001-of-01024_parsed_xac.conllu
PP	False	False	Plur	Not Pronoun	Plur	Not Pronoun	His own commemorative photos or favorite pictures carved in marble for a friend	let	let		let	root	His own commemorative photos or favorite pictures carved in marble for a friend, let them enjoy this timeless elegant gift, compared with the traditional shadow carving, laser carving shadow effect is more clear, uniform, three-dimensional sense of depth distinctive, Shadow carving laser machines have both speed and precision.	c4-train.00001-of-01024_parsed_xac.conllu
PS	False	False	Plur	Not Pronoun	Sing	Not Pronoun	targeted applications or a heat treatment	take	take	Plur	take	parataxis	Bed bugs dogs find the bed bugs, then targeted applications or a heat treatment take care of the rest.	c4-train.00001-of-01024_parsed_xac.conllu
SS	False	False	Sing	3	Sing	3	he or she	is	be	Sing	look	aux	When a dentist examines your teeth he or she is looking for indications of health and dental issues.	c4-train.00001-of-01024_parsed_xac.conllu
UNK	False	False	Sing	Not Pronoun	UNK	Not Pronoun	The whole term No Fear , or Fearless	is	be	Sing	insanity	cop	The whole term No Fear, or Fearless is complete insanity.	c4-train.00001-of-01024_parsed_xac.conllu
SS	False	False	Sing	3	Sing	3	he or she	has	have	Sing	do	aux	This is where children recognize and affirm what their teacher has done rather than evaluate what he or she has done.	c4-train.00001-of-01024_parsed_xac.conllu
UNK	False	False	UNK	Not Pronoun	UNK	Not Pronoun	most or all of the senior leaders ( board , C - suite ) in a company	are	be	Plur	man	cop	While recognizing that this type of club or organization doesn’t formally exist, when most or all of the senior leaders (board, C-suite) in a company are men, this perception can prevail among women.	c4-train.00001-of-01024_parsed_xac.conllu
SS	False	False	Sing	3	Sing	3	he or she	is	be	Sing	sponsor	aux	A sponsor is someone who works at the same organization in a more senior role than the individual he or she is sponsoring.	c4-train.00001-of-01024_parsed_xac.conllu
SS	False	False	Sing	Not Pronoun	Sing	Not Pronoun	your business or other organization	is	be	Sing	do	aux	What is your business or other organization doing in this area?	c4-train.00001-of-01024_parsed_xac.conllu
PP	False	False	Plur	Not Pronoun	Plur	Not Pronoun	small groups of men or small groups of women	chatting	chat		chat	advcl	It’s surprising how often informal office gatherings, breakroom conversations, and pre- or post-meetings end up with small groups of men or small groups of women chatting.	c4-train.00001-of-01024_parsed_xac.conllu
PP	False	False	Plur	Not Pronoun	Plur	Not Personal Pronoun	vulnerable young people with mental health needs or those recently released from custody	struggle	struggle		struggle	ccomp	All too often, we see vulnerable young people with mental health needs or those recently released from custody struggle, leading to an increased likelihood of them committing further crimes.	c4-train.00001-of-01024_parsed_xac.conllu
SS	False	False	Sing	Not Pronoun	Sing	Not Pronoun	a crown or moulding of gold	is	be	Sing	be	conj	it had to be gilded entirely in gold and a crown or moulding of gold is to be put around it.	c4-train.00001-of-01024_parsed_xac.conllu
SS	False	False	Sing	Not Pronoun	Sing	Not Pronoun	the way you raise your pigs or the location of your farm	varies	vary	Sing	vary	advcl	While the way you raise your pigs or the location of your farm varies, the core values of the pork family — honestly, on the whole — do not.	c4-train.00001-of-01024_parsed_xac.conllu
PP	False	False	Plur	Not Pronoun	Plur	Not Pronoun	the cute little sparrows flying in to pick up scraps , or the more raucous seagulls standing guard waiting for someone to leave their outside dish unattended	are	be	Plur	distraction	cop	On a quiet afternoon, the cute little sparrows flying in to pick up scraps, or the more raucous seagulls standing guard waiting for someone to leave their outside dish unattended, are also a nice distraction before getting back into the madness of the rat race.	c4-train.00001-of-01024_parsed_xac.conllu
PP	False	False	Plur	Not Pronoun	Plur	Not Pronoun	seasonal surges or high volume periods	Are	be	Plur	create	aux	Are seasonal surges or high volume periods creating challenging storage situations?	c4-train.00001-of-01024_parsed_xac.conllu
PP	False	False	Plur	Not Pronoun	Plur	Not Pronoun	Some diseases or medical conditions	have	have	Plur	have	root	Some diseases or medical conditions have symptoms that appear in the mouth.	c4-train.00001-of-01024_parsed_xac.conllu
UNK	False	False	UNK	Not Pronoun	Sing	Not Pronoun	the cultivated or the smaller more intensely coloured wild blueberry	offers	offer	Sing	offer	ccomp	You might be wondering whether the cultivated or the smaller more intensely coloured wild blueberry offers the most health benefits and this remains a hotly debated subject.	c4-train.00001-of-01024_parsed_xac.conllu
SS	False	False	Sing	3	Sing	3	he or she	has	have	Sing	have	ccomp	The person signing on behalf of a corporation, partnership, or trust may takes an oath or affirmation as an individual, swearing or affirming that he or she has both personal knowledge of the facts to be sworn to or affirmed and the authority to sign for the corporation, partnership, or trust.	c4-train.00001-of-01024_parsed_xac.conllu
SS	False	False	Sing	Not Pronoun	Sing	Not Pronoun	Last Price 29,000 or swap sa S10	add	add		add	root	Last Price 29,000 or swap sa S10 add po ako cash.	c4-train.00001-of-01024_parsed_xac.conllu
SS	False	False	Sing	3	Sing	3	he or she	feel	feel	Sing	feel	advcl:relcl	I have come to understand that not everyone is going to like what I write and may also feel comfortable expressing how he or she feel about it.	c4-train.00001-of-01024_parsed_xac.conllu
SS	False	False	Sing	Not Pronoun	Sing	Not Pronoun	Jeon or Buchimgae	is	be	Sing	dish	cop	Jeon or Buchimgae is a delicious and savoury Korean pancake-like dish made from various ingredients and they are mixed into a wheat flour-based batter, and then pan fried.	c4-train.00001-of-01024_parsed_xac.conllu
UNK	False	False	UNK	2	Sing	Not Pronoun	you ( or your man )	put	put	Sing	put	acl:relcl	So the next time you (or your man) put on that sharp suit try to look objectively at the entire ensemble.	c4-train.00001-of-01024_parsed_xac.conllu
SS	False	False	Sing	Not Pronoun	Sing	Not Pronoun	Each publicly - assisted college or university in Ontario	has	have	Sing	have	parataxis	Ontario First Generation Bursary Each publicly-assisted college or university in Ontario has their own application and sets the amount of the bursary, ranging from $1,000 to $3,500.	c4-train.00001-of-01024_parsed_xac.conllu
SS	False	False	Sing	3	Sing	3	he or she	has	have	Sing	access	aux	Before prescribing this medication, a doctor should make sure he or she has accessed each patients risk to the Mylan Fentanyl patch.	c4-train.00001-of-01024_parsed_xac.conllu
SS	False	False	Sing	3	Sing	3	he or she	has	have	Sing	have	root	While the CRO is not an owner of specific risks, he or she has the task of executing a strategic oversight of the entire risk management focus that mandates free access to the board for conveyance and reporting.	c4-train.00001-of-01024_parsed_xac.conllu
SS	False	False	Sing	Not Pronoun	Sing	Not Pronoun	a brother or mother	is	be	Sing	reach	aux	If you think a brother or mother is not reaching his or her full potential, are you supposed to look the other way, and just think, “My family, right or wrong”?	c4-train.00001-of-01024_parsed_xac.conllu
SS	False	False	Sing	Not Pronoun	Sing	Not Pronoun	your theme or style	is	be	Sing	whatever	cop	Whatever your theme or style is, we would love to create unique florals for your big day!	c4-train.00001-of-01024_parsed_xac.conllu
SP	False	False	Sing	Not Pronoun	Plur	Not Pronoun	“ Hannah Weiner ” or the “ bikini pants ” she is creating	is	be	Sing	product	cop	Similarly, the invitation puts in question whether “Hannah Weiner” or the “bikini pants” she is creating is in fact the “product.”	c4-train.00001-of-01024_parsed_xac.conllu
SS	False	False	Sing	Not Pronoun	Sing	Not Pronoun	Computer Numerical Control or CNC	is	be	Sing	method	cop	Computer Numerical Control or CNC is a method for automating 3-dimensional cutting and milling processes, and the best CNC routers will let you produce factory-grade work in a small home shop.	c4-train.00001-of-01024_parsed_xac.conllu
SS	False	False	Sing	Not Pronoun	Sing	Not Pronoun	the pupil or teacher	is	be	Sing	victim	cop	This is cyberbullying pure and simple – regardless of whether the pupil or teacher is the victim.	c4-train.00001-of-01024_parsed_xac.conllu
PS	False	False	Plur	Not Pronoun	Sing	Not Personal Pronoun	teachers or anyone	be	be		Facebook	cop	There’s no obligation for teachers or anyone to be on Facebook in the first place.	c4-train.00001-of-01024_parsed_xac.conllu
SS	False	False	Sing	Not Pronoun	Sing	Not Pronoun	a spirit or energy	is	be	Sing	I	cop	Some history on myself is that I am able to feel if a spirit or energy is around me, I am very in tune with energy and the spirits.	c4-train.00001-of-01024_parsed_xac.conllu
PS	False	False	Plur	Not Pronoun	Sing	Not Pronoun	Interviews , or at least request for interview ,	seem	seem	Plur	seem	root	Interviews, or at least request for interview, seem to be particularly effective, with 81% of applications requesting an interview eventually allowed.	c4-train.00001-of-01024_parsed_xac.conllu
SS	False	False	Sing	Not Pronoun	Sing	Not Pronoun	Robotic process automation ( or RPA )	is	be	Sing	form	cop	Robotic process automation (or RPA) is an emerging form of process automation technology based on the notion of software robots or artificial intelligence (AI) workers.	c4-train.00001-of-01024_parsed_xac.conllu
SS	False	False	Sing	Not Pronoun	Sing	Not Pronoun	This certified 5 k run ( or walk )	is	be	Sing	event	cop	This certified 5k run (or walk) is a family-fun event benefitting those in need in your community.	c4-train.00001-of-01024_parsed_xac.conllu
SS	False	False	Sing	Not Pronoun	Sing	Not Pronoun	the end of December ( or the beginning of January )	provides	provide	Sing	provide	root	And of course, the end of December (or the beginning of January) also provides the perfect time to create a set of new year’s resolutions that we can keep in mind throughout the course of the next 12 months, and that we create with the hopes of helping us live better and more productive lives in the future.	c4-train.00001-of-01024_parsed_xac.conllu
SS	False	False	Sing	Not Pronoun	Sing	Not Pronoun	The freedom or restriction of air flow	affects	affect	Sing	affect	root	The freedom or restriction of air flow affects the responsiveness of the mat and the level of direct control that the rider has.	c4-train.00001-of-01024_parsed_xac.conllu
PP	False	False	Plur	Not Pronoun	Plur	Not Pronoun	Channels , or grooves ,	separate	separate	Plur	separate	root	Channels, or grooves, separate the pontoons.	c4-train.00001-of-01024_parsed_xac.conllu
PP	False	False	Plur	Not Pronoun	Plur	Not Pronoun	a few pulls at the slot machine or hands of blackjack in our elegantly appointed Casino	are	be	Plur	draw	cop	For those in the gaming mood, a few pulls at the slot machine or hands of blackjack in our elegantly appointed Casino are the perfect draw.	c4-train.00001-of-01024_parsed_xac.conllu
SS	False	False	Sing	Not Pronoun	Sing	Not Pronoun	Almost any Wal - Mart or other large store	carries	carry	Sing	carry	root	Almost any Wal-Mart or other large store carries hardwood lump.	c4-train.00001-of-01024_parsed_xac.conllu
SS	False	False	Sing	Not Pronoun	Sing	Not Pronoun	Each work place or building	has	have	Sing	have	root	Each work place or building has its differences; be prepared to have a routine based around your own and your co-workers’ safety, vary your movements enough to eliminate predictability and modify learnt security measures to fit your surroundings.	c4-train.00001-of-01024_parsed_xac.conllu
SS	False	False	Sing	Not Pronoun	Sing	Not Pronoun	a local scrapper or commercial junk removal company	is	be	Sing	solution	cop	If you still can’t find someone to pick up your appliance, or you just don’t have the means to haul the unit yourself, you may find that a local scrapper or commercial junk removal company is a practical solution.	c4-train.00001-of-01024_parsed_xac.conllu
SS	False	False	Sing	Not Pronoun	Sing	Not Pronoun	your tub or shower	discards	discard	Sing	discard	ccomp	This is an important training that ensures that your tub or shower so that it discards the old, worn out and outdated look for a breathtaking and refreshing replacement shower doors.	c4-train.00001-of-01024_parsed_xac.conllu
PS	False	False	Plur	Not Pronoun	Sing	Not Pronoun	The alpha hydroxyl acids or AHA	are	be	Plur	chemical	cop	The alpha hydroxyl acids or AHA are chemicals that are wiped out from natural products.	c4-train.00001-of-01024_parsed_xac.conllu
SS	False	False	Sing	Not Pronoun	Sing	Not Pronoun	No groundbreaking business book or strong corporate culture	defines	define	Sing	define	root	No groundbreaking business book or strong corporate culture defines our commitment to helping others like the power of our guiding principles.	c4-train.00001-of-01024_parsed_xac.conllu
SS	False	False	Sing	3	Sing	3	he or she	has	have	Sing	have	advcl	A person can feel like he or she has the flu.	c4-train.00001-of-01024_parsed_xac.conllu
SP	False	False	Sing	Not Pronoun	Plur	Not Pronoun	Viral Status and / or it ’s licensors	own	own	Plur	own	root	Unless otherwise stated, Viral Status and/or it’s licensors own the intellectual property rights for all material on Viral Status.	c4-train.00001-of-01024_parsed_xac.conllu
SS	False	False	Sing	Not Pronoun	Sing	Not Pronoun	the bank or the title company	is	be	Sing	go	aux	Well, the bank or the title company is going to want to see what they call, quote, “fresh” letters of administration.	c4-train.00001-of-01024_parsed_xac.conllu
SS	False	False	Sing	Not Pronoun	Sing	Not Pronoun	the computer or technology	meets	meet	Sing	meet	ccomp	In advance checking the computer or technology meets the minimum criteria for running the assessments seems obvious but is sometimes overlooked.	c4-train.00001-of-01024_parsed_xac.conllu
SP	False	False	Sing	Not Pronoun	Plur	Not Pronoun	Dynamica Web Design Limited and / or its licensors	own	own	Plur	own	root	Under these Terms, Dynamica Web Design Limited and/or its licensors own all rights to the intellectual property and material contained in this Website, and all such rights are reserved.	c4-train.00001-of-01024_parsed_xac.conllu
SS	False	False	Sing	Not Pronoun	Sing	Not Pronoun	sickness or injury	strike	strike	Plur	strike	advcl	When sickness or injury strike, having health insurance can mean the difference between falling and getting again up and dropping out of the sport.	c4-train.00001-of-01024_parsed_xac.conllu
SS	False	False	Sing	Not Pronoun	Sing	Not Pronoun	your Vinson home or business	is	be	Sing	view	cop	If your Vinson home or business is in a clear view of the sky, then you can connect to our satellite communications system, you can also add phone or tv service.	c4-train.00001-of-01024_parsed_xac.conllu
SS	False	False	Sing	Not Pronoun	Sing	Not Pronoun	any policy or project	succeed	succeed		succeed	advcl	According to Ms Nhancale, for any policy or project to succeed, it is imperative to take into account social, economic and cultural factors.	c4-train.00001-of-01024_parsed_xac.conllu
SS	False	False	Sing	Not Pronoun	Sing	Not Pronoun	a proxy or VPN	work	work		work	advcl	Although, for a proxy or VPN to work it too has to be originating from a residential IP because Blizzard has most business IP addresses blacklisted to limit botting.	c4-train.00001-of-01024_parsed_xac.conllu
SS	False	False	Sing	Not Pronoun	Sing	Not Pronoun	each state or district	has	have	Sing	have	root	In fact, each state or district has the independent right and responsibility to take the Common Core Standards and develop or adopt a curriculum that outlines how much time to spend on each topic, and identifies age-appropriate materials and resources to be used.	c4-train.00001-of-01024_parsed_xac.conllu
