experiment_condition	has_either	has_neither	conj_1_number	conj_1_person	conj_2_number	conj_2_person	nsubj	verb_form	verb_lemma	verb_number	main_predicate_lemma	main_predicate_arc	sentence	filename
SS	False	False	Sing	Not Pronoun	Sing	Not Pronoun	for a new immigrant ( oleh hadash ) or expat	meet	meet		meet	acl	Joining one of these teams is a great way for a new immigrant (oleh hadash) or expat to meet and integrate with locals and have fun at the same time.	c4-train.00001-of-01024_parsed_xac.conllu
SS	False	False	Sing	Not Pronoun	Sing	Not Pronoun	The body , or mouth feel , of the wine	is	be	Sing	wine	cop	The body, or mouth feel, of the wine is more like white wine, with a crispness that makes it so refreshing in the hot summer and a versatile food wine.	c4-train.00001-of-01024_parsed_xac.conllu
SS	False	False	Sing	Not Pronoun	Sing	Not Pronoun	a soaker hose or drip line	is	be	Sing	investment	cop	If your spring weather tends to be dry, a soaker hose or drip line is always a good investment.	c4-train.00001-of-01024_parsed_xac.conllu
SS	False	False	Sing	Not Pronoun	Sing	Not Pronoun	A wheeled cart or planter	comes	come	Sing	come	root	A wheeled cart or planter comes in handy for this.	c4-train.00001-of-01024_parsed_xac.conllu
SS	False	False	Sing	Not Pronoun	Sing	Not Pronoun	addition or subtraction	needs	need	Sing	need	root	At this stage, addition or subtraction needs to be practical and visual using real objects.	c4-train.00001-of-01024_parsed_xac.conllu
SS	False	False	Sing	Not Pronoun	Sing	Not Pronoun	Number lotto or snap	are	be	Plur	game	cop	Number lotto or snap are good games for learning basic addition and subtraction equations.	c4-train.00001-of-01024_parsed_xac.conllu
PP	False	False	Plur	Not Pronoun	Plur	Not Pronoun	hackers or malicious actors	gain	gain	Plur	gain	acl:relcl	Often times the way hackers or malicious actors gain access to WordPress websites are through security holes in plugins.	c4-train.00001-of-01024_parsed_xac.conllu
PP	False	False	Plur	Not Pronoun	Plur	Not Pronoun	hackers or malicious actors	access	access		access	acl	This will eliminate the ability for hackers or malicious actors to access your site through security holes they may find in your plugins.	c4-train.00001-of-01024_parsed_xac.conllu
PP	False	False	Plur	Not Pronoun	Plur	Not Pronoun	hackers or malicious actors	exploit	exploit		exploit	acl	However, if the plugin still exists on the site then it could still be presenting security holes for hackers or malicious actors to exploit.	c4-train.00001-of-01024_parsed_xac.conllu
PS	False	False	Plur	Not Pronoun	Sing	Not Pronoun	New Years or the day before New Year	is	be	Sing	event	cop	New Years or the day before New Year is the most awaited New Year Love event all through the world.	c4-train.00001-of-01024_parsed_xac.conllu
SS	False	False	Sing	3	Sing	3	he or she	acts	act	Sing	act	acl:relcl	To deal with the narcissist and recover from his or her malign influence requires the ability to understand the way he or she acts and thinks.	c4-train.00001-of-01024_parsed_xac.conllu
SS	False	False	Sing	Not Pronoun	Sing	Not Pronoun	Trick or treating	is	be	Sing	tradition	cop	Trick or treating is a timeless tradition for millions of Americans.	c4-train.00001-of-01024_parsed_xac.conllu
SS	False	False	Sing	3	Sing	3	he or she on whom you may be placing so much faith	has	have	Sing	have	ccomp	Before appointing a superb and experienced legal professional it’s essential for the shopper to find extra concerning the client and make sure that he or she on whom you may be placing so much faith has the required skill set, experience and experience to handle your case successfully and give the verdict that you will be aspiring to get.	c4-train.00001-of-01024_parsed_xac.conllu
SS	False	False	Sing	Not Pronoun	Sing	Not Pronoun	Obsessive Compulsive Disorder , or OCD as it is more commonly referred to ,	is	be	Sing	condition	cop	Obsessive Compulsive Disorder, or OCD as it is more commonly referred to, is a condition which many people may think they understand.	c4-train.00001-of-01024_parsed_xac.conllu
PP	False	False	Plur	Not Pronoun	Plur	Not Pronoun	obsessive thoughts or compulsive behaviours	consumes	consume	Sing	consume	acl:relcl	“Patients who present with more severe symptoms, where obsessive thoughts or compulsive behaviours consumes their day to day life for more than three hours a day, will be referred to a specialist, like me, who can discuss breaking the cycle, often through cognitive behavioral therapy (CBT), exposure (facing the fear ‘head on’) or possibly medication."	c4-train.00001-of-01024_parsed_xac.conllu
SS	False	False	Sing	Not Pronoun	Sing	Not Pronoun	a friend or relative	displaying	display		display	advcl	Anyone who is worried about a friend or relative displaying such behaviours should make them an appointment to see their GP and it is surprising, with the right help, how quickly patients can overcome it."	c4-train.00001-of-01024_parsed_xac.conllu
SS	False	False	Sing	Not Pronoun	Sing	Not Pronoun	this sliminess – or mucilage substance –	facilitates	facilitate	Sing	facilitate	root	And this sliminess – or mucilage substance – also facilitates smooth peristalsis of food, aiding digestion and helping against constipation.	c4-train.00001-of-01024_parsed_xac.conllu
SS	False	False	Sing	Not Pronoun	Sing	Not Pronoun	A decree or affirmation	is	be	Sing	prayer	cop	A decree or affirmation is a prayer with power.	c4-train.00001-of-01024_parsed_xac.conllu
SS	False	False	Sing	Not Pronoun	Sing	Not Pronoun	Your Body Elemental or inner body intelligence	is	be	Sing	awaken	aux	Your Body Elemental or inner body intelligence is awakening, and if you will pay attention, it will direct you to the proper food and diet.	c4-train.00001-of-01024_parsed_xac.conllu
SS	False	False	Sing	Not Pronoun	Sing	Not Pronoun	Each boyfrienc or law	has	have	Sing	have	root	Each boyfrienc or law has its own table of contents page, to show you what's in nugget poker wendover section.	c4-train.00001-of-01024_parsed_xac.conllu
SP	False	False	Sing	Not Pronoun	Plur	Not Pronoun	a Lemon Tree in a pot in a sunny position or Gazanias ( also known as the Treasure Flower )	work	work	Plur	work	root	To complete the Mediterranean look, a Lemon Tree in a pot in a sunny position or Gazanias (also known as the Treasure Flower) work very well in south-facing gardens and well-drained soil.	c4-train.00001-of-01024_parsed_xac.conllu
SS	False	False	Sing	Not Pronoun	Sing	Not Pronoun	a baby or toddler	gets	get	Sing	get	advcl	Falls: what to do when a baby or toddler gets a bump on.	c4-train.00001-of-01024_parsed_xac.conllu
SS	False	False	Sing	Not Pronoun	Sing	Not Pronoun	your baby or toddler	falls	fall	Sing	fall	advcl	Find out what to do if your baby or toddler falls, how to treat a bump on the head or other head injury, when to call the doctor, and how to prevent injuries what to do when a baby or toddler gets a bump on the head find out whether it's okay for your baby to doze off after he's fallen or hit his head.	c4-train.00001-of-01024_parsed_xac.conllu
SS	False	False	Sing	Not Pronoun	Sing	Not Pronoun	a baby or toddler	gets	get	Sing	get	advcl	Find out what to do if your baby or toddler falls, how to treat a bump on the head or other head injury, when to call the doctor, and how to prevent injuries what to do when a baby or toddler gets a bump on the head find out whether it's okay for your baby to doze off after he's fallen or hit his head.	c4-train.00001-of-01024_parsed_xac.conllu
PP	False	False	Plur	Not Pronoun	Plur	Not Pronoun	Fallen trees or limbs that have fallen from standing trees	are	be	Plur	responsibility	cop	Note: Fallen trees or limbs that have fallen from standing trees are the responsibility of the property owner.	c4-train.00001-of-01024_parsed_xac.conllu
SS	False	False	Sing	Not Pronoun	Sing	Not Pronoun	one container or one bag	is	be	Sing	person	cop	That way, you know that one container or one bag is for one person.	c4-train.00001-of-01024_parsed_xac.conllu
SS	False	False	Sing	Not Pronoun	Sing	Not Pronoun	Grand Bay , or Baie ,	is	be	Sing	bay	cop	Grand Bay, or Baie, as the name suggests is a sheltered bay along the north coast.	c4-train.00001-of-01024_parsed_xac.conllu
SS	False	False	Sing	Not Pronoun	Sing	Not Pronoun	your application or cloud service	deploys	deploy	Sing	deploy	advcl:relcl	An Azure storage account replication (LRS, ZRS, GRS, RA-GRS) should be selected based on how your application or cloud service deploys.	c4-train.00001-of-01024_parsed_xac.conllu
PP	False	False	Plur	Not Pronoun	Plur	Not Pronoun	not all cities or towns	participate	participate	Plur	participate	ccomp	(It is important to note that not all cities or towns participate in the quota system.)	c4-train.00001-of-01024_parsed_xac.conllu
SS	False	False	Sing	Not Pronoun	Sing	Not Pronoun	a city or town	has	have	Sing	have	advcl	When a city or town has a license available they can be applied for with a simple administration fee.	c4-train.00001-of-01024_parsed_xac.conllu
UNK	False	False	UNK	2	Plur	Not Pronoun	you or any other taxpayers	do	do	Sing	owe	aux	At no time are taxes involved so at no time do you or any other taxpayers owe anything.	c4-train.00001-of-01024_parsed_xac.conllu
SS	False	False	Sing	Not Pronoun	Sing	Not Pronoun	A1A or Atlantic Avenue	is	be	Sing	road	cop	A1A or Atlantic Avenue is the main road that serves the area, and is where you'll find the majority of the luxury oceanfront condos.	c4-train.00001-of-01024_parsed_xac.conllu
PP	False	False	Plur	Not Pronoun	Plur	Not Pronoun	Private investigators or private detectives who 're inside the field	are	be	Plur	risk	aux	Private investigators or private detectives who're inside the field are often risking their lives since of the nature of their job.	c4-train.00001-of-01024_parsed_xac.conllu
SS	False	False	Sing	Not Pronoun	Sing	Not Pronoun	the suspect or the target person	does	do	Sing	know	aux	Gathering information would be more accurate if the suspect or the target person does not know that he or she is becoming watched or surveyed otherwise he or she would act unnaturally towards the private investigator and private detective.	c4-train.00001-of-01024_parsed_xac.conllu
SS	False	False	Sing	3	Sing	3	he or she	is	be	Sing	interact	aux	Sometimes it really is imperative to gather information from the target individual directly by asking him or her a number of questions or basic concerns and at times it is also crucial to collect data from the target person when he or she is interacting with another person.	c4-train.00001-of-01024_parsed_xac.conllu
SS	False	False	Sing	Not Pronoun	Sing	Not Pronoun	the soil or compost	does	do	Sing	dry	aux	Water regularly during the growing season ensuring that the soil or compost does not dry out while the plant is gettng established.	c4-train.00001-of-01024_parsed_xac.conllu
SS	False	False	Sing	Not Pronoun	Sing	Not Pronoun	your home or business property	Has	have	Sing	suffer	aux	Has your home or business property suffered flood damage?	c4-train.00001-of-01024_parsed_xac.conllu
SS	False	False	Sing	Not Pronoun	Sing	Not Pronoun	Geoff Johns ( _Green Lantern_ ) or Brian Bendis ( _Avengers_ )	do	do	Plur	do	acl:relcl	It’s really just middle-of-the-road superhero comic stuff–the sort of thing that Geoff Johns (_Green Lantern_) or Brian Bendis (_Avengers_) do, and do pretty well–but with a big old helping of *super-violence*.	c4-train.00001-of-01024_parsed_xac.conllu
PP	False	False	Plur	Not Pronoun	Plur	Not Pronoun	CGroups , or control groups ,	are	be	Plur	do	aux	CGroups, or control groups, are basically doing nothing more than resource limiting.	c4-train.00001-of-01024_parsed_xac.conllu
PP	False	False	Plur	Not Pronoun	Plur	Not Pronoun	Canadians or other groups	making	make		make	ccomp	If you heard Canadians or other groups making comments about your culture the way you do about them, how would you feel?	c4-train.00001-of-01024_parsed_xac.conllu
SP	False	False	Sing	3	Plur	Not Pronoun	he , or scientists from Friends of the Earth	need	need	Plur	need	root	If Craig Bennett believes in Man Made Climate Change, then he, or scientists from Friends of the Earth, need to step into full view of the carbon-taxed, often fuel-poor public, and debate this multibillion dollar question.	c4-train.00001-of-01024_parsed_xac.conllu
SS	False	False	Sing	Not Pronoun	Sing	Not Pronoun	basketball or hockey	are	be	Plur	itinerary	cop	If basketball or hockey aren’t on your itinerary, catch a concert in the multi-purpose arena.	c4-train.00001-of-01024_parsed_xac.conllu
SS	False	False	Sing	Not Pronoun	Sing	Not Pronoun	a sudden change in income or a significant , unavoidable expense	makes	make	Sing	make	root	For others, a sudden change in income or a significant, unavoidable expense makes abiding by the terms of the decree very difficult, or outright impossible.	c4-train.00001-of-01024_parsed_xac.conllu
UNK	False	False	UNK	2	UNK	2	" You " or " Your "	refers	refer	Sing	refer	root	"You" or "Your" refers to the User.	c4-train.00001-of-01024_parsed_xac.conllu
PP	False	False	Plur	Not Pronoun	Plur	Not Pronoun	kids ( or adults )	have	have	Plur	have	ccomp	Who says kids (or adults) have to dislike brussels sprouts?	c4-train.00001-of-01024_parsed_xac.conllu
PS	False	False	Plur	Not Pronoun	Sing	Not Pronoun	Some background vocals or an occasional second guitar part	give	give	Plur	give	root	Some background vocals or an occasional second guitar part give the listener something to return to.	c4-train.00001-of-01024_parsed_xac.conllu
SS	False	False	Sing	3	Sing	3	he or she	is	be	Sing	use	aux	When a sculptor casts an artwork, he or she is using the process of _______________.	c4-train.00001-of-01024_parsed_xac.conllu
SS	False	False	Sing	Not Pronoun	Sing	Not Pronoun	your home ’s roof or siding	Has	have	Sing	suffer	aux	Has your home’s roof or siding suffered damage from a recent storm?	c4-train.00001-of-01024_parsed_xac.conllu
PP	False	False	Plur	Not Pronoun	Plur	Not Pronoun	Trends or points of convergence	emerge	emerge	Plur	emerge	root	Trends or points of convergence usually emerge as the interviews proceed.	c4-train.00001-of-01024_parsed_xac.conllu
SP	False	False	Sing	3	Plur	3	Her – or them	leaving	leave		leave	csubj	Her – or them leaving me had absolutely nothing to do with me or how they felt about me.	c4-train.00001-of-01024_parsed_xac.conllu
PS	False	False	Plur	Not Pronoun	Sing	Not Pronoun	Magazines , or TV ,	are	be	Plur	estimate	cop	Magazines, or TV, are only estimates or extrapolations on the possible audience and, therefore, the receivers are can be measured in the Internet is very exactly who done how long what is and what is not has done.	c4-train.00001-of-01024_parsed_xac.conllu
SS	False	False	Sing	Not Pronoun	Sing	Not Pronoun	their parent or caretaker	is	be	Sing	volunteer	cop	Note: Children ages 0 -4 will not be able to participate unless their parent or caretaker is a registered VBS volunteer.	c4-train.00001-of-01024_parsed_xac.conllu
SS	False	False	Sing	Not Pronoun	Sing	Not Pronoun	the actress or actor that appear in the video Toys " R " Us 2 - Day Sale Roar	is	be	Sing	who	cop	Who are the actors or who is the actress or actor that appear in the video Toys "R" Us 2-Day Sale Roar!	c4-train.00001-of-01024_parsed_xac.conllu
UNK	False	False	Plur	Not Pronoun	UNK	Not Personal Pronoun	the actors or who is the actress or actor that appear in the video Toys " R " Us 2 - Day Sale Roar	are	be	Plur	who	cop	Who are the actors or who is the actress or actor that appear in the video Toys "R" Us 2-Day Sale Roar!	c4-train.00001-of-01024_parsed_xac.conllu
SS	False	False	Sing	Not Pronoun	Sing	Not Pronoun	The buffet or the cafeteria	is	be	Sing	car	cop	The buffet or the cafeteria is in Car 9.	c4-train.00001-of-01024_parsed_xac.conllu
SS	False	False	Sing	Not Pronoun	Sing	Not Pronoun	Lego® - Based Therapy , or Lego® - Club as it called by group members ,	is	be	Sing	treatment	cop	Lego®-Based Therapy, or Lego®-Club as it called by group members, is an evidenced based treatment where children develop skills through collaboration on group projects through the use of Lego®.	c4-train.00001-of-01024_parsed_xac.conllu
SS	False	False	Sing	Not Pronoun	Sing	Not Pronoun	an Angry Bird or a Temple Run	develops	develop	Sing	develop	ccomp	One can argue that an Angry Bird or a Temple Run develops great reflexes and motor skills – but is that the objective?	c4-train.00001-of-01024_parsed_xac.conllu
SS	False	False	Sing	Not Pronoun	Sing	Not Pronoun	that song or project	is	be	Sing	what	cop	If the target doesn’t like it, then you know that song or project is not what you need to invest in.	c4-train.00001-of-01024_parsed_xac.conllu
SS	False	False	Sing	Not Pronoun	Sing	Not Pronoun	an affidavit or release	accompany	accompany	Plur	accompany	advcl	They may be able to remove it, insure over it, or even possibly discard it if an affidavit or release accompany it.	c4-train.00001-of-01024_parsed_xac.conllu
SS	False	False	Sing	Not Pronoun	Sing	Not Pronoun	coffee or caffeine	stunt	stint	Plur	stint	csubj	That’s what your mother told you when you wanted a sip, but it’s not true that coffee or caffeine stunt growth, says Lindsay Malone.	c4-train.00001-of-01024_parsed_xac.conllu
PP	False	False	Plur	Not Pronoun	Plur	Not Pronoun	no pillars or supports	come	come	Plur	come	advcl	It completely opens up the stands as no pillars or supports come in the way of the spectator’s view.	c4-train.00001-of-01024_parsed_xac.conllu
SS	False	False	Sing	Not Pronoun	Sing	Not Pronoun	The Eppendorf EasyCon tablet or MultiCon PC	provide	provide	Plur	provide	root	The Eppendorf EasyCon tablet or MultiCon PC provide simple operation.	c4-train.00001-of-01024_parsed_xac.conllu
SP	False	False	Sing	Not Pronoun	Plur	Not Pronoun	the PACC or home sewing people	manage	manage	Plur	manage	advcl:relcl	I don’t know how the PACC or home sewing people manage to get away with that but they’d get laughed out of the room on this side of things so I’m not going to dispute those standards knowing nothing about them (they don’t make sense to me) but that discussion doesn’t belong here.	c4-train.00001-of-01024_parsed_xac.conllu
SS	False	False	Sing	Not Pronoun	Sing	Not Pronoun	your house ( or some other asset )	is	be	Sing	rise	aux	Economists call it the ‘‘wealth’’ effect: if you feel rich because your house (or some other asset) is rising in value, you are going to feel better about spending money in general.	c4-train.00001-of-01024_parsed_xac.conllu
SS	False	False	Sing	Not Pronoun	Sing	Not Pronoun	Any change or disruption in the housing market	is	be	Sing	go	aux	Any change or disruption in the housing market is going to impact spending decisions and the broader economy almost immediately.	c4-train.00001-of-01024_parsed_xac.conllu
SS	False	False	Sing	Not Pronoun	Sing	Not Pronoun	A civic center or civic centre	is	be	Sing	area	cop	A civic center or civic centre is a prominent land area within a community that is constructed to be its focal point or center.	c4-train.00001-of-01024_parsed_xac.conllu
PS	False	False	Plur	Not Pronoun	Sing	Not Pronoun	no bra straps or cleavage	showing	show		show	advcl	Tank-tops are ok with no bra straps or cleavage showing.	c4-train.00001-of-01024_parsed_xac.conllu
PS	False	False	Plur	Not Pronoun	Sing	Not Pronoun	freshly roasted cocoa beans or cheese in chocolate	do	do	Plur	taste	aux	What do freshly roasted cocoa beans or cheese in chocolate taste like?	c4-train.00001-of-01024_parsed_xac.conllu
SS	False	False	Sing	Not Pronoun	Sing	Not Pronoun	local faculty or visiting professor faculty	are	be	Plur	provide	aux	Attendance is mandatory when local faculty or visiting professor faculty are providing lectures on Ob/Gyn topics.	c4-train.00001-of-01024_parsed_xac.conllu
SP	False	False	Sing	Not Pronoun	Plur	Not Pronoun	your withholding or estimated tax payments	equal	equal	Plur	equal	advcl	You can also avoid the penalty if your withholding or estimated tax payments equal at least 90% of your tax due for the current year, or 100% of the tax shown on your return for the prior year.	c4-train.00001-of-01024_parsed_xac.conllu
SS	False	False	Sing	Not Pronoun	Sing	Not Pronoun	A cast - iron sauté pan or stove - top griddle	allows	allow	Sing	allow	root	A cast-iron sauté pan or stove-top griddle also allows you to make many different types of foods, from stove-top casseroles to panini.	c4-train.00001-of-01024_parsed_xac.conllu
SS	False	False	Sing	Not Pronoun	Sing	Not Pronoun	nicotinamide adenine dinucleotide with high - energy hydrogen , or NADH	is	be	Sing	spark	cop	Also known as coenzyme 1, nicotinamide adenine dinucleotide with high-energy hydrogen, or NADH, is the "spark" that ignites energy production in the body's cells.	c4-train.00001-of-01024_parsed_xac.conllu
SS	False	False	Sing	Not Pronoun	Sing	Not Pronoun	which tank and / or pump	produces	produce	Sing	produce	acl	TE Keep track of each of your fuel pumps and tanks, by storing information about their location, model, capacity, etc. TE Optionally associate a pump and a tank with each fuel grade, for keeping track of fuel inventory, and better tracking of which tank and/or pump produces the most sales.	c4-train.00001-of-01024_parsed_xac.conllu
PP	False	False	Plur	Not Pronoun	Plur	Not Pronoun	the springs or hinges	need	need	Plur	need	ccomp	After cleaning, you can also see clearly whether the springs or hinges need to be repaired.	c4-train.00001-of-01024_parsed_xac.conllu
PP	False	False	Plur	Not Pronoun	Plur	Not Pronoun	Thematic Funds or Sectoral Mutual Funds	are	be	Plur	option	cop	Thematic Funds or Sectoral Mutual Funds are among few popular investment options.	c4-train.00001-of-01024_parsed_xac.conllu
PP	False	False	Plur	Not Pronoun	Plur	Not Pronoun	A Thematic Funds or Sectoral Mutual Funds	are	be	Plur	fund	cop	A Thematic Funds or Sectoral Mutual Funds are theme-based funds.	c4-train.00001-of-01024_parsed_xac.conllu
SS	False	False	Sing	Not Pronoun	Sing	Not Pronoun	a “ blind hole ” or “ blind via ”	refers	refer	Sing	refer	root	For purposes of this specification, a “blind hole” or “blind via” refers to a hole or aperture that extends only partially through the substrate 12 or is otherwise closed at one end.	c4-train.00001-of-01024_parsed_xac.conllu
SS	False	False	Sing	3	Sing	3	he or she	needs	need	Sing	need	root	Whether your dog rides in a sidecar, a motorcycle, or in the back of a pickup, he or she needs eye protection.	c4-train.00001-of-01024_parsed_xac.conllu
UNK	False	False	UNK	Not Pronoun	UNK	Not Pronoun	one or more of these vessels	become	become	Plur	become	advcl	When one or more of these vessels become clogged, blood circulation is interrupted towards a part of the heart, which will then be damaged.	c4-train.00001-of-01024_parsed_xac.conllu
SP	False	False	Sing	Not Pronoun	Plur	Not Pronoun	your experience and / or interests	align	align	Plur	align	advcl:relcl	Discussion of how your experience and/or interests align with the mission, vision, and work of Community Health Center.	c4-train.00001-of-01024_parsed_xac.conllu
SS	False	False	Sing	3	Sing	3	he or she	directs	direct	Sing	direct	root	When a composer says to play “largo desolato,” in terms of musical notation, he or she directs symphony musicians to perform “big and lonely.”	c4-train.00001-of-01024_parsed_xac.conllu
SS	False	False	Sing	Not Pronoun	Sing	Not Pronoun	Loss or theft of confidential data	poses	pose	Sing	pose	root	Loss or theft of confidential data poses a serious threat to small and big firms alike.	c4-train.00001-of-01024_parsed_xac.conllu
SS	False	False	Sing	Not Pronoun	Sing	Not Pronoun	DWEK or DSO	is	be	Sing	type	cop	DWEK or DSO is a type of Corneal graft.	c4-train.00001-of-01024_parsed_xac.conllu
SS	False	False	Sing	Not Pronoun	Sing	Not Pronoun	your son or daughter	eats	eat	Sing	eat	acl:relcl	However if you think of the cumulative effects of eating pesticides treated foods every single day of our lives, if you think of all the strawberries or apples (or apple juice or apple sauce) or peaches your son or daughter eats in the course of 5 years, it definitely adds up.	c4-train.00001-of-01024_parsed_xac.conllu
SS	False	False	Sing	3	Sing	3	she or he	has	have	Sing	establish	aux	Within the aftermath of concentrating in on a single professional who seems to be a suitable option for the home remodeling project in Dixon, California the following move to make is to see over any paperwork that she or he has established for you.	c4-train.00001-of-01024_parsed_xac.conllu
PP	False	False	Plur	Not Pronoun	Plur	Not Pronoun	different drugs or different dosages	do	do	Plur	look	aux	The second is to install more safeguards, such as having another person check to make sure that different drugs or different dosages don’t look similar, reducing the chance that the wrong bottle will be used.	c4-train.00001-of-01024_parsed_xac.conllu
PP	False	False	Plur	Not Pronoun	Plur	Not Pronoun	green cicadas or “ leafhoppers ”	bite	bite	Plur	bite	root	During the growing process, green cicadas or “leafhoppers” bite the leaves, stimulating a hormonal reaction in the tea tree that develops its natural honey flavor.	c4-train.00001-of-01024_parsed_xac.conllu
SS	False	False	Sing	Not Pronoun	Sing	Not Pronoun	Over the top utilization of toothpaste wealthy in fluoride or utilization of water high in fluoride content for washing	causes	cause	Sing	cause	root	Over the top utilization of toothpaste wealthy in fluoride or utilization of water high in fluoride content for washing causes fluorosis.	c4-train.00001-of-01024_parsed_xac.conllu
SS	False	False	Sing	Not Pronoun	Sing	Not Pronoun	A Vail / Beaver Creek , Colorado area wedding or party in the Rocky Mountains	is	be	Sing	experience	cop	A Vail / Beaver Creek, Colorado area wedding or party in the Rocky Mountains is always a memorable mountain experience.	c4-train.00001-of-01024_parsed_xac.conllu
