experiment_condition	has_either	has_neither	conj_1_number	conj_1_person	conj_2_number	conj_2_person	nsubj	verb_form	verb_lemma	verb_number	main_predicate_lemma	main_predicate_arc	sentence	filename
SS	False	False	Sing	Not Pronoun	Sing	Not Pronoun	loss of phospholipase PLA2G6 or a reduction in Vps35	causes	cause	Sing	cause	ccomp	"We propose that loss of phospholipase PLA2G6 or a reduction in Vps35 causes a disruption of retromer function that creates an insidious stress for the cell and is potentially at the root of these conditions.	c4-train.00001-of-01024_parsed_xaa.conllu
SS	False	False	Sing	Not Pronoun	Sing	Not Pronoun	A clean towel or shop rag	makes	make	Sing	make	root	A clean towel or shop rag makes a good insulating surface if working under the hood.	c4-train.00001-of-01024_parsed_xaa.conllu
SP	False	False	Sing	Not Pronoun	Plur	Not Pronoun	the estate or its grounds	remain	remain	Plur	remain	advcl	At certain times of year a house may be closed while the estate or its grounds remain open.	c4-train.00001-of-01024_parsed_xaa.conllu
PP	False	False	Plur	Not Pronoun	Plur	Not Pronoun	Minnesota corporations or corporations from other jurisdictions	have	have	Plur	have	advcl	Where Minnesota corporations or corporations from other jurisdictions have difficulties getting paid for goods or services delivered to Minnesota companies, our firm serves as a collection resource and to enforce security agreements arising from UCC-1 Financing Statements or to seek replevin (repossession) of delivered goods that have not been paid for.	c4-train.00001-of-01024_parsed_xaa.conllu
SS	False	False	Sing	3	Sing	3	he or she	retains	retain	Sing	retain	acl	Kaheru suggested that the reforms should include the incumbent handing over his office to the next in the hierarchy in the event that he intends to run again for office, as well as setting benchmarks on what presidential privileges he or she retains as a candidate.	c4-train.00001-of-01024_parsed_xaa.conllu
SS	False	False	Sing	Not Pronoun	Sing	Not Pronoun	any person or company	does	do	Sing	use	aux	If any person or company does use the owner of this websites name, video, or blog content without getting written consent from the site then legal action may be undertaken against the offending parties.	c4-train.00001-of-01024_parsed_xaa.conllu
UNK	False	False	Sing	Not Pronoun	UNK	Not Pronoun	sabre rattling ( or worse ) in North Korea	has	have	Sing	have	root	Although, there appears to be a good level of momentum in the near-term, sabre rattling (or worse) in North Korea has the potential to disrupt appetite for risk.	c4-train.00001-of-01024_parsed_xaa.conllu
SS	False	False	Sing	Not Pronoun	Sing	Not Pronoun	Any good April Fools joke , or any joke , for that matter ,	works	work	Sing	work	root	Any good April Fools joke, or any joke, for that matter, only works when a person’s expectation in undermined by a TRUTH they did not see coming, leaving them surprised and undone, even laughing.	c4-train.00001-of-01024_parsed_xaa.conllu
SS	False	False	Sing	Not Pronoun	Sing	Not Pronoun	Gay pride or LGBT pride	is	be	Sing	stance	cop	Gay pride or LGBT pride is the positive stance against discrimination and violence toward LGBT people to promote their self-affirmation, equality rights, increase their visibility as a social group, build community, and celebrate sexual diversity and gender variance.	c4-train.00001-of-01024_parsed_xaa.conllu
PP	False	False	Plur	Not Pronoun	Plur	Not Pronoun	Business metrics or KPIs	display	display	Plur	display	root	According to a study, “Business metrics or KPIs display a measurable value that shows the progress of a company’s goals.”	c4-train.00001-of-01024_parsed_xaa.conllu
SS	False	False	Sing	Not Pronoun	Sing	Not Pronoun	Dortmund or Bayern	enter	enter	Plur	enter	ccomp	It’s quite hard to say if Dortmund or Bayern enter the final stretch of the season as favourites.	c4-train.00001-of-01024_parsed_xaa.conllu
SS	False	False	Sing	Not Pronoun	Sing	Not Pronoun	a criterium , or crit for short ,	is	be	Sing	race	cop	For those not in the know, a criterium, or crit for short, is a timed, hour long race.	c4-train.00001-of-01024_parsed_xaa.conllu
SS	False	False	Sing	Not Pronoun	Sing	Not Pronoun	whose previous husband or wife	is	be	Sing	live	aux	7) In marriages requiring episcopal permission for the clergy to officiate at the wedding of a person whose previous husband or wife is living, under Canon I.19.3c, the bishop providing episcopal support will also provide the needed permission.	c4-train.00001-of-01024_parsed_xaa.conllu
PS	False	False	Plur	Not Pronoun	Sing	Not Pronoun	a gems or steel	have	have	Plur	have	root	Initially, a gems or steel have to be chosen for the facility rock.	c4-train.00001-of-01024_parsed_xaa.conllu
SS	True	False	Sing	Not Pronoun	Sing	Not Pronoun	either Netherlands or Italy	has	have	Sing	win	aux	Since 1969 either Netherlands or Italy has won the European Cup.	c4-train.00001-of-01024_parsed_xaa.conllu
SS	False	False	Sing	Not Pronoun	Sing	Not Pronoun	“ Watt peak ” , or Wp	is	be	Sing	output	cop	“Watt peak”, or Wp is the total output when the sun is at its max.	c4-train.00001-of-01024_parsed_xaa.conllu
SS	False	False	Sing	Not Pronoun	Sing	Not Pronoun	Each module or panel	has	have	Sing	have	root	Each module or panel has about 60 to 96 cells standard for residential application.	c4-train.00001-of-01024_parsed_xaa.conllu
SS	False	False	Sing	3	Sing	3	he or she	intends	intend	Sing	intend	acl:relcl	This way, you will get time to test and know the strategies that he or she intends to use in addressing your unique needs.	c4-train.00001-of-01024_parsed_xaa.conllu
PP	False	False	Plur	Not Pronoun	Plur	Not Pronoun	irresponsible marketers or criminals	find	find		find	acl	One thing you need to keep in mind is that almost all online activities are recorded and you are leaving a digital foot print with tracks for irresponsible marketers or criminals to find you.	c4-train.00001-of-01024_parsed_xaa.conllu
UNK	False	False	UNK	2	Sing	Not Pronoun	you or your organization	has	have	Sing	have	advcl	If you or your organization has any interest in culture, Katie’s experience and insight is worth its weight in gold.	c4-train.00001-of-01024_parsed_xaa.conllu
SP	False	False	Sing	Not Pronoun	Plur	Not Pronoun	the extent of the pressure ulcer or other factors	prohibit	prohibit	Plur	prohibit	advcl	If the extent of the pressure ulcer or other factors prohibit it from healing properly, surgery may be necessary to close the wound.	c4-train.00001-of-01024_parsed_xaa.conllu
SS	False	False	Sing	Not Pronoun	Sing	Not Pronoun	overnight oatmeal or cooked oatmeal	are	be	Plur	option	cop	Rolled or steel-cut oats make a great breakfast choice, and overnight oatmeal or cooked oatmeal are both good options depending on how you like to prepare your oatmeal.	c4-train.00001-of-01024_parsed_xaa.conllu
SS	False	False	Sing	Not Pronoun	Sing	Not Pronoun	aeldresagen ( or DaneAge Association )	is	be	Sing	organisation	cop	For more information go to: aeldresagen, aeldresagen (or DaneAge Association) is a Danish elderly organisation, founded in 1986, that wants to promote a society without age barriers and ageism.	c4-train.00001-of-01024_parsed_xaa.conllu
SS	False	False	Sing	3	Sing	3	he or she	paddles	paddle	Sing	paddle	advcl	This is because while kayaking one uses many muscles as he or she paddles and steers the vessel.	c4-train.00001-of-01024_parsed_xaa.conllu
UNK	False	False	UNK	2	Sing	Not Pronoun	you or a loved one	Have	have	Sing	go	aux	Have you or a loved one ever gone through something like this?	c4-train.00001-of-01024_parsed_xaa.conllu
PP	False	False	Plur	Not Pronoun	Plur	Not Pronoun	the shocks or struts	require	require	Plur	require	root	When the vehicle travels over a bump and bounces excessively, the shocks or struts require replacement.	c4-train.00001-of-01024_parsed_xaa.conllu
SS	False	False	Sing	Not Pronoun	Sing	Not Pronoun	this campground or RV park	is	be	Sing	option	cop	If you like camping with pets this campground or RV park is an option.	c4-train.00001-of-01024_parsed_xaa.conllu
SS	False	False	Sing	Not Pronoun	Sing	Not Pronoun	this campground or RV park	offers	offer	Sing	offer	root	If you need a campsite with sewer hookups this campground or RV park offers them.	c4-train.00001-of-01024_parsed_xaa.conllu
SS	False	False	Sing	3	Sing	3	he or she	has	have	Sing	face	aux	The speaker explains about the challenges he or she has faced during the entrepreneurial journey and how they have managed to overcome them with the solutions created.	c4-train.00001-of-01024_parsed_xaa.conllu
PP	False	False	Plur	Not Pronoun	Plur	Not Personal Pronoun	The foods you consume or those you do n’t	are	be	Plur	what	cop	The foods you consume or those you don’t are what determine whether you’ll lose weight or not.	c4-train.00001-of-01024_parsed_xaa.conllu
SS	False	False	Sing	3	Sing	3	he or she	has	have	Sing	have	advcl	Would an employee be able to contribute the single maximum to his or her health savings account (HSA) even though he or she has family coverage in this case?	c4-train.00001-of-01024_parsed_xaa.conllu
SS	True	False	Sing	Not Pronoun	Sing	Not Pronoun	either the deductible for the family as a whole or the deductible for an individual family member	is	be	Sing	deductible	cop	If either the deductible for the family as a whole or the deductible for an individual family member is below the minimum annual deductible for family coverage, the plan does not qualify as an HDHP.	c4-train.00001-of-01024_parsed_xaa.conllu
PP	False	False	Plur	Not Pronoun	Plur	Not Pronoun	your articles or documents	are	be	Plur	web	cop	If your articles or documents are on the web, name plays a principal function in the entire phenomenon.	c4-train.00001-of-01024_parsed_xaa.conllu
PP	False	False	Plur	Not Pronoun	Plur	Not Pronoun	Wanzl pallet systems or pallet containers	look	look	Plur	look	root	Wanzl pallet systems or pallet containers not only look good in the warehouse but also – in specific campaign weeks or during a sales – directly at the point of sale, i.e. in the sales areas: pallet systems attract customers’ attention, are immediately accessible and can be returned to the warehouse after the end of the campaign.	c4-train.00001-of-01024_parsed_xaa.conllu
SS	False	False	Sing	Not Pronoun	Sing	Not Pronoun	their foot or hand	is	be	Sing	hurt	aux	They’ve made several attempts, their foot or hand is hurting, tears are welling in their eyes, they want to give up but hundreds of people are there watching.	c4-train.00001-of-01024_parsed_xaa.conllu
SS	False	False	Sing	Not Pronoun	Sing	Not Pronoun	your boss or manager	has	have	Sing	have	root	Either way, your boss or manager has to see satisfying your ask as the path to achieving his or her goals as well as yours.	c4-train.00001-of-01024_parsed_xaa.conllu
SS	False	False	Sing	Not Pronoun	Sing	Not Pronoun	the boss or team	wants	want	Sing	want	acl:relcl	What’s the pain point the boss or team wants to solve — to make more money, be more efficient, be more productive?	c4-train.00001-of-01024_parsed_xaa.conllu
SS	False	False	Sing	Not Pronoun	Sing	Not Pronoun	an album or tape	builds	build	Sing	build	root	The change in pace and mood as an album or tape builds from one song to the next, the familiarity of the order comforting.	c4-train.00001-of-01024_parsed_xaa.conllu
SS	False	False	Sing	Not Pronoun	Sing	Not Pronoun	The Main Appliance Service Country wide Price Guidebook or MASNPG	is	be	Sing	tool	cop	The Main Appliance Service Country wide Price Guidebook or MASNPG is an excellent tool that really helps to alleviate a number of the stress and uncertainty that goes along with having an appliance repaired.	c4-train.00001-of-01024_parsed_xaa.conllu
UNK	False	False	UNK	Not Pronoun	UNK	Not Pronoun	one or two	slip	slip		slip	csubj	With so many new sites being created each day that aggregate and share your info, it’s entirely possible for one or two to slip through the cracks.	c4-train.00001-of-01024_parsed_xaa.conllu
PP	False	False	Plur	Not Pronoun	Plur	Not Pronoun	the main people and / or resources that people should know about in the R&E realm	are	be	Plur	who	cop	Who are the main people and/or resources that people should know about in the R&E realm?	c4-train.00001-of-01024_parsed_xaa.conllu
SS	False	False	Sing	Not Pronoun	Sing	Not Pronoun	Each new experience or encounter	helps	help	Sing	help	root	Each new experience or encounter helps lay the foundations for their development as they grow.	c4-train.00001-of-01024_parsed_xaa.conllu
UNK	False	False	UNK	2	Sing	Not Personal Pronoun	you or someone you know	Do	do	Sing	feel	aux	Do you or someone you know feel led by God and are considering the Catholic Church as your spirtual home?	c4-train.00001-of-01024_parsed_xaa.conllu
UNK	False	False	UNK	2	Sing	Not Pronoun	you or a third party appointed by you other than the carrier	has	have	Sing	have	conj	The withdrawal period will be fourteen days from the date on which you or a third party appointed by you other than the carrier have/has taken possession of the goods.	c4-train.00001-of-01024_parsed_xaa.conllu
SP	False	False	Sing	Not Pronoun	Plur	Not Pronoun	His photography , or perhaps more accurately his photo collages ,	display	display	Plur	display	root	His photography, or perhaps more accurately his photo collages, display an exquisite technical proficiency that throws the incredibly surrealistic subject matter that has become his hallmark.	c4-train.00001-of-01024_parsed_xaa.conllu
PP	False	False	Plur	Not Pronoun	Plur	Not Pronoun	Capital gains or losses	refer	refer	Plur	refer	root	Capital gains or losses refer to what you earn from selling property that you use for either personal or investment purposes.	c4-train.00001-of-01024_parsed_xaa.conllu
SS	False	False	Sing	Not Pronoun	Sing	Not Pronoun	Microsoft Project ( or MSP )	is	be	Sing	program	cop	Microsoft Project (or MSP) is a project management software program developed and sold by Microsoft.	c4-train.00001-of-01024_parsed_xaa.conllu
SS	False	False	Sing	Not Pronoun	Sing	Not Pronoun	Hyper - flashing or " rapid flashing "	occurs	occur	Sing	occur	root	Hyper-flashing or "rapid flashing" occurs when you change the technology for your car bulbs from halogen to LED.	c4-train.00001-of-01024_parsed_xaa.conllu
PP	False	False	Plur	Not Pronoun	Plur	Not Pronoun	Outdoor activities or physical activities	build	build	Plur	build	root	Outdoor activities or physical activities build our character &, with the implementation of a few Mind Games, we can sweat & also discover more about ourselves; i.e. strengths & weaknesses.	c4-train.00001-of-01024_parsed_xaa.conllu
SS	False	False	Sing	Not Pronoun	Sing	Not Pronoun	gluing or welding	is	be	Sing	problem	cop	In addition, gluing or welding is no problem at all.	c4-train.00001-of-01024_parsed_xaa.conllu
UNK	False	False	UNK	2	Sing	Not Personal Pronoun	you or someone you know	has	have	Sing	have	advcl	If you or someone you know ever has the chance to go abroad, seize the opportunity.	c4-train.00001-of-01024_parsed_xaa.conllu
SS	False	False	Sing	Not Pronoun	Sing	Not Pronoun	an insurance agent or financial advisor	helping	help		help	acl	The problem with an insurance agent or financial advisor helping you with Medi-Cal planning is that more often than not their primary motive is to sell you a “Medi-Cal Exempt Annuity.”	c4-train.00001-of-01024_parsed_xaa.conllu
SS	False	False	Sing	Not Pronoun	Sing	Not Pronoun	an insurance agent or financial planner	has	have	Sing	have	advcl	Where an insurance agent or financial planner has their eye on the commission potential of an annuity sale, an experienced Medi-Cal planning attorney will be focused on helping you to create a successful Medi-Cal plan that ensures your future eligibility while safeguarding assets in the meantime.	c4-train.00001-of-01024_parsed_xaa.conllu
SS	False	False	Sing	3	Sing	3	he or she	goes	go	Sing	go	parataxis	I think the way Jane describes the student’s experience is perfect – he or she goes in with some expectation, and all of a sudden the lesson has flown by and they have achieved something.	c4-train.00001-of-01024_parsed_xaa.conllu
SS	False	False	Sing	Not Pronoun	Sing	Not Pronoun	The page title or title tag	works	work	Sing	work	root	The page title or title tag works as your name in the digital landscape.	c4-train.00001-of-01024_parsed_xaa.conllu
SS	False	False	Sing	Not Pronoun	Sing	Not Pronoun	Alternate text or alt text for short	is	be	Sing	attribute	cop	Alternate text or alt text for short is an attribute that’s added to an image tag in HTML.	c4-train.00001-of-01024_parsed_xaa.conllu
SS	False	False	Sing	Not Pronoun	Sing	Not Pronoun	A business website or Business profile	are	be	Plur	option	cop	A business website or Business profile are good options to publish and share your content on.	c4-train.00001-of-01024_parsed_xaa.conllu
SS	False	False	Sing	Not Pronoun	Sing	Not Pronoun	cast iron or SG iron , as the material of choice in the manufacturing of these types of sheave wheels ,	plays	play	Sing	play	advcl:relcl	This is where cast iron or SG iron, as the material of choice in the manufacturing of these types of sheave wheels, plays an important role.	c4-train.00001-of-01024_parsed_xaa.conllu
SS	False	False	Sing	Not Pronoun	Sing	Not Pronoun	the artist or rather the MuKul , Ponger ’s fictional Museum of Foreign and Familiar Cultures ,	presents	present	Sing	present	root	Within the separate space of the wedge, the artist or rather the MuKul, Ponger’s fictional Museum of Foreign and Familiar Cultures, presents staged photographs from various years (“Participating Observer”, “Otaheite Olé”, “Garden Party”) alongside a newly created 480-minute video piece (“The Master Narrative and Don Durito”, 2017).	c4-train.00001-of-01024_parsed_xaa.conllu
PP	False	False	Plur	Not Pronoun	Plur	Not Pronoun	forwarding companies or lorry drivers	get	get	Plur	get	root	On the other hand, forwarding companies or lorry drivers get the opportunity to book one of these parking spaces in advance, making route scheduling much easier, or even on the move if it is easier to estimate within which time frame the next parking space is available.	c4-train.00001-of-01024_parsed_xaa.conllu
SS	False	False	Sing	Not Pronoun	Sing	Not Pronoun	a dog or other pet	damages	damage	Sing	damage	advcl	If a dog or other pet continuously damages the common elements, causes unreasonable disturbances (continuous barking or other pet noise), or is a repeated nuisance, the pet owner may be required by the Board to have the animal permanently removed from the Building upon five (5) days written notice to the owner.	c4-train.00001-of-01024_parsed_xaa.conllu
SS	False	False	Sing	Not Pronoun	Sing	Not Pronoun	a criminal element or a delinquent	expects	expect	Sing	expect	root	Therefore, while committing a crime a criminal element or a delinquent reasonably expects that nothing will impede them to do it with impunity.	c4-train.00001-of-01024_parsed_xaa.conllu
SS	False	False	Sing	Not Pronoun	Sing	Not Pronoun	The risen Man , or man in indefeasible life ,	wears	wear	Sing	wear	root	The risen Man, or man in indefeasible life, wears a heavenly image.	c4-train.00001-of-01024_parsed_xaa.conllu
SS	False	False	Sing	Not Pronoun	Sing	Not Pronoun	Disability Insurance - ( DI ) or disability income insurance ,	is	be	Sing	form	cop	Disability Insurance - (DI) or disability income insurance, is a form of insurance that insures the beneficiary's earned income against the risk that a disability will make working uncomfortable (as with psychological disorders), painful (as with back pain), or impossible (as with coma).	c4-train.00001-of-01024_parsed_xaa.conllu
SS	False	False	Sing	Not Pronoun	Sing	Not Pronoun	IRR or “ internal rate of return ” ,	is	be	Sing	term	cop	IRR or “internal rate of return”, is a finance term used to express a project returns as an interest rate.	c4-train.00001-of-01024_parsed_xaa.conllu
SS	False	False	Sing	Not Pronoun	Sing	Not Pronoun	a bigger PV or NPV	makes	make	Sing	make	ccomp	Remember that a bigger PV or NPV makes a project more attractive, and that NPV calculations have already factored in the cost of the project.	c4-train.00001-of-01024_parsed_xaa.conllu
SS	False	False	Sing	Not Pronoun	Sing	Not Pronoun	VSphere 4 's Update 2 ( or U2 )	breaks	break	Sing	break	parataxis	In June 2010, a VMware representative who promotes new Knowledge Base (KB) articles posted an urgent note on Twitter: VSphere 4's Update 2 (or U2) breaks VMware View's PC-over-IP (PCoIP) functionality.	c4-train.00001-of-01024_parsed_xaa.conllu
SS	False	False	Sing	Not Pronoun	Sing	Not Pronoun	mommy or daddy	making	make		make	advcl	So the child's favorite dessert is what we will do, if the child is old enough to help make it, it will be their special time with mommy or daddy making it!	c4-train.00001-of-01024_parsed_xaa.conllu
SS	False	False	Sing	Not Pronoun	Sing	Not Pronoun	the electronic control module or ECM	manages	manage	Sing	manage	advcl:relcl	Learning how the electronic control module or ECM manages engine performance by controlling outputs and actuators becomes a lot of fun for some.	c4-train.00001-of-01024_parsed_xaa.conllu
UNK	False	False	Sing	Not Pronoun	UNK	Not Pronoun	A better man than me , or than most ,	passes	pass	Sing	pass	root	A better man than me, or than most, passes I trust to his gallant reward.	c4-train.00001-of-01024_parsed_xaa.conllu
SS	False	False	Sing	Not Pronoun	Sing	Not Pronoun	Any pollution or contamination of one portion of the groundwater	has	have	Sing	have	root	Any pollution or contamination of one portion of the groundwater has long-lasting effects on the entire belt.	c4-train.00001-of-01024_parsed_xaa.conllu
SS	False	False	Sing	Not Pronoun	Sing	Not Pronoun	their delivery style or timing	is	be	Sing	interfere	aux	If their delivery style or timing is interfering with their desired impact, this can be a great opportunity to let the deliverer know about that disconnect.	c4-train.00001-of-01024_parsed_xaa.conllu
SS	False	False	Sing	3	Sing	3	he or she	attempts	attempt	Sing	attempt	advcl	Also, your pet may choke on the egg if he or she attempts to swallow it whole.	c4-train.00001-of-01024_parsed_xaa.conllu
SS	False	False	Sing	Not Pronoun	Sing	Not Pronoun	A bar or banner	is	be	Sing	overlay	cop	A bar or banner is an overlay that sits at the top or bottom of the browser window and is a great tactic for globally displaying important messaging, bringing attention to certain landing pages, and as an effective email capture method on mobile browsers.	c4-train.00001-of-01024_parsed_xaa.conllu
SP	False	False	Sing	Not Pronoun	Plur	Not Pronoun	for the public – or their surrogates in the news media	know	know		know	xcomp	Often, in the most serious times of public tragedy, we see that Texans have ceded to government officials total discretion to decide what is good and not good for the public – or their surrogates in the news media – to know.	c4-train.00001-of-01024_parsed_xaa.conllu
UNK	False	False	UNK	2	Sing	Not Pronoun	you or a member of the family	travels	travel	Sing	travel	advcl	When you or a member of the family travels, the fear of a repeat scenario is created.	c4-train.00001-of-01024_parsed_xaa.conllu
PP	False	False	Plur	Not Pronoun	Plur	Not Pronoun	these or any other unwanted side effects	persist	persist	Plur	persist	advcl	If these or any other unwanted side effects persist, contact your doctor or pharmacist to talk about it with them.	c4-train.00001-of-01024_parsed_xaa.conllu
SS	False	False	Sing	3	Sing	3	he or she	wants	want	Sing	want	acl:relcl	Whether it’s learning to ask for what he or she wants, staying on topic during conversations, asking questions during conversations or using the right amount of eye contact, being a peer mentor has opened my eyes to how much effort it takes individuals with autism to hold a conversation, something I previously took for granted.	c4-train.00001-of-01024_parsed_xaa.conllu
SS	False	False	Sing	Not Pronoun	Sing	Not Pronoun	a new major game or new company	appears	appear	Sing	appear	advcl	If a new major game or new company appears I put it second on the list below The Zone BBS - Games.	c4-train.00001-of-01024_parsed_xaa.conllu
PP	False	False	Plur	Not Pronoun	Plur	Not Pronoun	Licensed auditors or HVAC pros	use	use	Plur	use	root	Licensed auditors or HVAC pros use blower doors and thermographic cameras to find areas where air and heat infiltration occur.	c4-train.00001-of-01024_parsed_xaa.conllu
UNK	False	False	UNK	Not Pronoun	UNK	Not Pronoun	one or more of the registrants	withdraw	withdraw	Plur	withdraw	acl	Please send an message to info@palgravekitchen.org to be added to the Wait List for the Camp in the event that one or more of the registrants withdraw.	c4-train.00001-of-01024_parsed_xaa.conllu
SS	False	False	Sing	Not Pronoun	Sing	Not Pronoun	chauvinism or discrimination	is	be	Sing	enigma	cop	As to the constant state of unease we hear women leaders express — clearly, chauvinism or discrimination is an enigma that organizations (and the business culture) should work hard to prevent.	c4-train.00001-of-01024_parsed_xaa.conllu
SS	False	False	Sing	Not Pronoun	Sing	Not Pronoun	A bob cut or bob	is	be	Sing	haircut	cop	A bob cut or bob is a short- to medium-length haircut for women (and occasionally men) in which the hair is typically cut straight around the head at about jaw-level, often with a fringe (or "bangs") at the front.	c4-train.00001-of-01024_parsed_xaa.conllu
SS	False	False	Sing	Not Pronoun	Sing	Not Pronoun	Cash or Electronic transfer into Bumpy Jumpy Castles account	are	be	Plur	method	cop	• Cash or Electronic transfer into Bumpy Jumpy Castles account are the preferred method of payment - no cheque’s will be accepted.	c4-train.00001-of-01024_parsed_xaa.conllu
SS	False	False	Sing	Not Pronoun	Sing	Not Pronoun	your age or current fitness level	is	be	Sing	what	cop	It doesn't matter what your age or current fitness level is... this is the perfect program for you.	c4-train.00001-of-01024_parsed_xaa.conllu
