experiment_condition	has_either	has_neither	conj_1_number	conj_1_person	conj_2_number	conj_2_person	nsubj	verb_form	verb_lemma	verb_number	main_predicate_lemma	main_predicate_arc	sentence	filename
SS	False	False	Sing	3	Sing	3	he or she	fails	fail	Sing	fail	advcl	An imbalanced Throat (Vishuddha) Chakra indicates fears, limiting beliefs, low self-confidence, frustration and helplessness that a person subjects him or herself to, when he or she fails to find solutions to problems and this condition triggers Hair Fall disorder.	c4-train.00001-of-01024_parsed_xaa.conllu
SP	False	False	Sing	Not Pronoun	Plur	Not Pronoun	shorter duration of effect or late day side effects	appear	appear	Plur	appear	advcl	6–17yrs: Initially apply one 10mg patch to hip 2hrs before desired effect, remove 9hrs after application; may remove earlier if shorter duration of effect or late day side effects appear.	c4-train.00001-of-01024_parsed_xaa.conllu
SS	False	False	Sing	Not Pronoun	Sing	Not Pronoun	The spin quantum number , or s ,	is	be	Sing	number	cop	The spin quantum number, or s, is the final quantum number and is also the only quantum number that has no dependence on any of the other quantum numbers, but instead depends on the quantum mechanical properties of electrons themselves.	c4-train.00001-of-01024_parsed_xaa.conllu
SP	False	False	Sing	Not Pronoun	Plur	Not Pronoun	Our in - house detailing facility or mobile detailing services	range	range	Plur	range	root	Our in-house detailing facility or mobile detailing services range from a mini detail to a premiere complete restoration.	c4-train.00001-of-01024_parsed_xaa.conllu
SS	False	False	Sing	3	Sing	3	him or her	getting	get		get	advcl	In other words, now you can easily bug your spouse's Smartphone without him or her getting the faintest idea of what is going on?	c4-train.00001-of-01024_parsed_xaa.conllu
SS	False	False	Sing	Not Pronoun	Sing	Not Pronoun	Mt. Everest , or Sagarmatha as the Nepalese call it ,	rises	rise	Sing	rise	root	Mt. Everest, or Sagarmatha as the Nepalese call it, rises 8,848m.	c4-train.00001-of-01024_parsed_xaa.conllu
UNK	False	False	Sing	Not Personal Pronoun	UNK	Not Pronoun	Anyone from New England ( or most anywhere else )	knows	know	Sing	know	root	Anyone from New England (or most anywhere else) knows that at the very least you: season the lobstaaah, and buttaaah and toast the rolls.	c4-train.00001-of-01024_parsed_xaa.conllu
PP	False	False	Plur	Not Pronoun	Plur	Not Pronoun	“ Powders ” or “ Washing Powders ” –	Means	means	Sing	means	root	“Powders” or “Washing Powders” – Means Washing Detergent.	c4-train.00001-of-01024_parsed_xaa.conllu
SS	False	False	Sing	3	Sing	3	he or she	is	be	Sing	feel	aux	It's important that your child take all of the antibiotics, even if he or she is feeling better within a day or two.	c4-train.00001-of-01024_parsed_xaa.conllu
SS	False	False	Sing	3	Sing	3	he or she	has	have	Sing	have	conj	This is more likely if your child is very young at the time of his or her first infection, or if he or she has repeated infections.	c4-train.00001-of-01024_parsed_xaa.conllu
SS	False	False	Sing	3	Sing	3	he or she	has	have	Sing	have	aux	Which of these tests is ordered for your child depends on your child's age, gender, how many infections he or she has had, and how bad the infections were.	c4-train.00001-of-01024_parsed_xaa.conllu
SS	False	False	Sing	3	Sing	3	he or she	feels	feel	Sing	feel	advcl	You can help your child's bladder instability by having him or her go to the bathroom every two or three hours, whether he or she feels the need to go or not (this is called “timed voiding”).	c4-train.00001-of-01024_parsed_xaa.conllu
SS	False	False	Sing	Not Pronoun	Sing	Not Pronoun	a sequence of returns or sequence of risk	works	work	Sing	work	acl	If you have any other questions about how a sequence of returns or sequence of risk works, and you want me to try to take more of the financial jargon out of this video, please let us know and we’ll be more than happy to help you out.	c4-train.00001-of-01024_parsed_xaa.conllu
SS	False	True	Sing	1	Sing	3	Neither myself or him	have	have	Plur	find	aux	Neither myself or him have found anyone else nor are we looking.	c4-train.00001-of-01024_parsed_xaa.conllu
SS	False	False	Sing	3	Sing	3	he or she	is	be	Sing	play	aux	Because the lenses do not ever leave home, parents do not have to worry about the child losing them while he or she is playing.	c4-train.00001-of-01024_parsed_xaa.conllu
SS	False	False	Sing	Not Pronoun	Sing	Not Pronoun	Myopia , or nearsightedness	is	be	Sing	become	aux	Myopia, or nearsightedness, is becoming more common.	c4-train.00001-of-01024_parsed_xaa.conllu
PP	False	False	Plur	Not Pronoun	Plur	Not Pronoun	the Learning Activities or Units	do	do	Plur	load	aux	If the Learning Activities or Units do not load correctly, try reloading the page.	c4-train.00001-of-01024_parsed_xaa.conllu
SS	False	False	Sing	Not Pronoun	Sing	Not Pronoun	Demand - initiated regeneration , or DIR ,	helps	help	Sing	help	root	Demand-initiated regeneration, or DIR, helps to conserve water, salt, electricity, and money.	c4-train.00001-of-01024_parsed_xaa.conllu
SS	False	False	Sing	Not Pronoun	Sing	Not Pronoun	Gold vermeil , or just vermeil ,	refers	refer	Sing	refer	root	Gold vermeil, or just vermeil, refers to items made of silver that are plated with a thin layer of gold.	c4-train.00001-of-01024_parsed_xaa.conllu
UNK	False	False	UNK	2	Sing	Not Personal Pronoun	you or someone you know	needs	need	Sing	need	advcl	If you or someone you know needs help curbing their substance misuse, reach out today to a Carrollton drug rehab center or a Carrollton alcohol rehab center.	c4-train.00001-of-01024_parsed_xaa.conllu
UNK	False	False	UNK	2	Sing	Not Personal Pronoun	you or someone you know	is	be	Sing	need	cop	If you or someone you know is in need of help with a substance use disorder, don’t be afraid to reach out.	c4-train.00001-of-01024_parsed_xaa.conllu
SS	False	False	Sing	Not Pronoun	Sing	Not Pronoun	AA or NA	do	do	Plur	resonate	aux	If AA or NA don’t resonate with you, you could look into SMART Recovery meetings instead.	c4-train.00001-of-01024_parsed_xaa.conllu
SP	False	False	Sing	Not Pronoun	Plur	Not Pronoun	life , or player decisions ,	result	result	Plur	result	root	Some nights, life, or player decisions, result in an encounter that the GM has not prepped for.	c4-train.00001-of-01024_parsed_xaa.conllu
SS	False	False	Sing	Not Pronoun	Sing	Not Pronoun	a jug or a door - knob	making	make		make	conj	"We had this idea of drawers and boxes opening up, and maybe a jug or a door-knob making friends with each other, falling in love even - very little text, but structured rather in the way that when children play, they make-believe that objects can be whatever they want.	c4-train.00001-of-01024_parsed_xaa.conllu
SS	False	False	Sing	Not Pronoun	Sing	Not Pronoun	the pharynx or the back part of the throat	becomes	become	Sing	become	advcl	It happens when the pharynx or the back part of the throat becomes inflamed due to a bacterial or viral infection.	c4-train.00001-of-01024_parsed_xaa.conllu
PP	False	False	Plur	Not Pronoun	Plur	Not Pronoun	restricted driving permits or Monitoring Device Driving Permits	have	have	Plur	become	aux	Due to recent legislation, restricted driving permits or Monitoring Device Driving Permits have become more widely available.	c4-train.00001-of-01024_parsed_xaa.conllu
SS	False	False	Sing	Not Pronoun	Sing	Not Pronoun	damage or theft	does	do	Sing	occur	aux	But if damage or theft does occur, that means higher out-of-pocket costs.	c4-train.00001-of-01024_parsed_xaa.conllu
UNK	False	False	UNK	2	Sing	Not Personal Pronoun	you or someone you know	is	be	Sing	struggle	aux	If you or someone you know is struggling to conceive, see a chiropractor to insure the body is functioning properly.	c4-train.00001-of-01024_parsed_xaa.conllu
UNK	False	False	Sing	Not Pronoun	UNK	Not Pronoun	Walt O’Brien ’s group Inside - Out ( or 3 - In - One , featuring ex-Pawn Ken Peters and drummer Dave Drum )	plays	play	Sing	play	root	Currently, Walt O’Brien’s group Inside-Out (or 3-In-One, featuring ex-Pawn Ken Peters and drummer Dave Drum) still plays local clubs in the area.	c4-train.00001-of-01024_parsed_xaa.conllu
PP	False	False	Plur	Not Pronoun	Plur	Not Pronoun	What bands or figures in musical history	drive	drive	Plur	drive	root	What bands or figures in musical history drive who you are now and want to become in the future?	c4-train.00001-of-01024_parsed_xaa.conllu
PP	False	False	Plur	Not Pronoun	Plur	Not Pronoun	Republicans or Democrats	have	have	Plur	do	aux	I'll bet that if I ask 100 people in Boulder whether Republicans or Democrats have done more to reduce greenhouse gases, nearly all would say "Democrats," and only after they stopped laughing at the absurdity of the question.	c4-train.00001-of-01024_parsed_xaa.conllu
SS	False	False	Sing	Not Pronoun	Sing	Not Pronoun	TAR , or predictive coding ,	is	be	Sing	alternative	cop	TAR, or predictive coding, is an alternative to the traditional manual review of documents.	c4-train.00001-of-01024_parsed_xaa.conllu
SS	False	False	Sing	Not Pronoun	Sing	Not Pronoun	Technology Assisted Review ( TAR ) , or predictive coding ,	is	be	Sing	alternative	cop	Technology Assisted Review (TAR), or predictive coding, is an alternative to the traditional manual review of documents.	c4-train.00001-of-01024_parsed_xaa.conllu
PP	False	False	Plur	Not Pronoun	Plur	Not Pronoun	new issues or interpretations	arise	arise	Plur	arise	conj	This allows the reviewers to quickly identify legally significant documents, and to adapt the process when new documents are added, or new issues or interpretations arise.	c4-train.00001-of-01024_parsed_xaa.conllu
SS	False	False	Sing	3	Sing	3	he or she	thinks	think	Sing	think	acl:relcl	‘Deep learning’ AI algorithms work by a human telling the AI algorithm what he or she thinks is correct or important, based on a small set of documents.	c4-train.00001-of-01024_parsed_xaa.conllu
SS	False	False	Sing	Not Pronoun	Sing	Not Pronoun	whose boyfriend or husband	loves	love	Sing	love	ccomp	But.....a girl likes to be wooed on the same day as many other girls are being wooed, so we can compare whose boyfriend or husband loves us the bestest!	c4-train.00001-of-01024_parsed_xaa.conllu
SS	False	False	Sing	Not Pronoun	Sing	Not Pronoun	Movement or firing	uses	use	Sing	use	root	Movement or firing uses up fuel though levels can be replenished by shooting the fuel dumps.	c4-train.00001-of-01024_parsed_xaa.conllu
SS	False	False	Sing	Not Pronoun	Sing	Not Pronoun	such owner or any other person	has	have	Sing	cause	aux	(2) The owner of any such timber, raft or other thing shall be liable to pay the reasonable expenses of the removal thereof, and if such owner or any other person has without lawful excuse caused any such obstruction or impediment, or causes any public nuisance affecting or likely to affect such free navigation or lawful use, he shall also be punishable with fine which may extend to one hundred taka.	c4-train.00001-of-01024_parsed_xaa.conllu
SS	False	False	Sing	Not Pronoun	Sing	Not Pronoun	one culture or religion	dominates	dominate	Sing	dominate	acl:relcl	We no longer live in a provincial land where one culture or religion dominates and dictates.	c4-train.00001-of-01024_parsed_xaa.conllu
SS	False	False	Sing	3	Sing	3	he or she	trades	trade	Sing	trade	root	Then he or she trades in a style that complements strengths and minimizes weaknesses.	c4-train.00001-of-01024_parsed_xaa.conllu
SS	False	False	Sing	Not Pronoun	Sing	Not Pronoun	Bloomberg or " the company "	is	be	Sing	occur	cop	Bloomberg or "the company" is statistically significant weight loss occurred, overall the effects are small.	c4-train.00001-of-01024_parsed_xaa.conllu
PP	False	False	Plur	Not Pronoun	Plur	Not Pronoun	GMPs , or good manufacturing practices ,	make	make	Plur	make	advcl:relcl	This is where GMPs, or good manufacturing practices, make a huge difference.	c4-train.00001-of-01024_parsed_xaa.conllu
PP	False	False	Plur	Not Pronoun	Plur	Not Pronoun	GMOs , or genetically modified organisms ,	are	be	Plur	organism	cop	GMOs, or genetically modified organisms, are organisms that have been produced through genetic engineering, typically by combining genes from a variety of sources, including plant, animal, bacterial, and viral genes, to create a different organism, but one that doesn’t occur naturally.	c4-train.00001-of-01024_parsed_xaa.conllu
SS	False	False	Sing	Not Pronoun	Sing	Not Pronoun	National Institute of Technology , Kurukshetra ( or NIT Kurukshetra ) ,	is	be	Sing	institute	cop	National Institute of Technology, Kurukshetra (or NIT Kurukshetra), is a public engineering institute located in Kurukshetra.	c4-train.00001-of-01024_parsed_xaa.conllu
SS	False	False	Sing	Not Pronoun	Sing	Not Pronoun	the child or young person	presents	present	Sing	present	acl:relcl	These meetings will be chaired by the appropriate level of staff depending on the level of risk that the child or young person presents.	c4-train.00001-of-01024_parsed_xaa.conllu
SP	False	False	Sing	Not Pronoun	Plur	Not Pronoun	sand or leaves	cover	cover	Plur	cover	advcl	In a bunker or water hazard, if sand or leaves cover your ball, you may remove enough of the sand or leaves to be able to see a part of the ball.	c4-train.00001-of-01024_parsed_xaa.conllu
UNK	False	False	UNK	2	Sing	Not Pronoun	you or your partner	move	move	Sing	move	advcl	If you or your partner move either of your balls on purpose or accidentally, add a penalty stroke to your score, replace it and play it.	c4-train.00001-of-01024_parsed_xaa.conllu
SS	False	False	Sing	Not Personal Pronoun	Sing	Not Personal Pronoun	someone or something else ( like your opponent ’s golf ball )	moves	move	Sing	move	advcl	If someone or something else (like your opponent’s golf ball) moves your ball, there is no penalty – but you must replace it.	c4-train.00001-of-01024_parsed_xaa.conllu
SS	False	False	Sing	Not Pronoun	Sing	Not Pronoun	your ball or your stance	is	be	Sing	ground	cop	If your ball or your stance is in abnormal ground, you may either play the ball as it lies, or find the nearest point of relief, not nearer the hole, and drop the ball within one clublength of that place.	c4-train.00001-of-01024_parsed_xaa.conllu
PP	False	False	Plur	Not Pronoun	Plur	Not Pronoun	certain institutions or individuals	are	be	Plur	position	cop	Structure at the meaning that certain institutions or individuals are in better positions to determine which books should be read as against a individual’s personal choice of books to read.	c4-train.00001-of-01024_parsed_xaa.conllu
UNK	True	False	UNK	2	Plur	1	either you or we	are	be	Plur	breach	cop	If either you or we are in breach of the arrangements under this Agreement, neither of us will be responsible for any losses that the other suffers as a result, except those losses which are a foreseeable consequence of the breach.	c4-train.00001-of-01024_parsed_xaa.conllu
PP	False	False	Plur	Not Pronoun	Plur	Not Pronoun	Heavy images or broken links	are	be	Plur	couple	cop	Heavy images or broken links are a couple of common problems on websites.	c4-train.00001-of-01024_parsed_xaa.conllu
PP	False	False	Plur	Not Pronoun	Plur	Not Pronoun	nearby lakes or rivers	overflow	overflow	Plur	overflow	advcl	Unfortunately, basement flooding occurs when nearby lakes or rivers overflow its banks.	c4-train.00001-of-01024_parsed_xaa.conllu
UNK	False	False	UNK	Not Pronoun	UNK	Not Pronoun	some ( or all ) of these internet sites	run	run	Plur	run	advcl	This latter fact is explicit true when some (or all) of these internet sites run a good amount of dynamic content.	c4-train.00001-of-01024_parsed_xaa.conllu
SS	False	False	Sing	Not Pronoun	Sing	Not Pronoun	hand or dry	washing	wash		wash	advcl	Maintain the embroidery on your jeans by hand or dry washing the jeans, avoid machine wash or tumble dryers.	c4-train.00001-of-01024_parsed_xaa.conllu
SS	False	False	Sing	Not Pronoun	Sing	Not Pronoun	The Severe Prediction Center or SPC	has	have	Sing	place	aux	The Severe Prediction Center or SPC has placed a slight risk for severe weather tomorrow over portions of NC/SC?VA for tomorrow.	c4-train.00001-of-01024_parsed_xaa.conllu
SS	False	False	Sing	Not Pronoun	Sing	Not Pronoun	Marxism , or socialism ,	has	have	Sing	fail	aux	In his New York essay, Chait concludes that Marxism, or socialism, “has failed everywhere it has been tried,” by which he means authoritarian communism has failed — essentially omitting all anti-authoritarian socialists and socialist parties from history.	c4-train.00001-of-01024_parsed_xaa.conllu
SS	False	False	Sing	Not Pronoun	Sing	Not Pronoun	AARP or the consumer counsel	is	be	Sing	who	cop	“Who is AARP or the consumer counsel to second guess what consumers clearly want?”	c4-train.00001-of-01024_parsed_xaa.conllu
PS	False	False	Plur	Not Pronoun	Sing	Not Pronoun	2 square miles ( 6 km² ) , or 0.35 % ,	is	be	Sing	water	cop	According to the U.S. Census Bureau, the county has a total area of 658 square miles (1,704 km²), of which 656 square miles (1,698 km²) is land and 2 square miles (6 km²), or 0.35%, is water.	c4-train.00001-of-01024_parsed_xaa.conllu
PP	False	False	Plur	Not Pronoun	Plur	Not Pronoun	affected ewes or cows with blistered , sore udders	refuse	refuse	Plur	refuse	advcl	Animals do not die from eating spring parsley, but losses occur when affected ewes or cows with blistered, sore udders refuse to nurse their young.	c4-train.00001-of-01024_parsed_xaa.conllu
UNK	False	False	UNK	Not Pronoun	UNK	Not Pronoun	More or Less	is	be	Sing	collection	cop	Out via Arts & Crafts, More or Less is an inspired collection of wonderfully relatable songs that manage to eschew the confines of what you might expect from a singer-songwriter.	c4-train.00001-of-01024_parsed_xaa.conllu
SS	False	False	Sing	Not Pronoun	Sing	Not Pronoun	a company or an entity	checks	check	Sing	check	acl:relcl	Did you know that every 30 seconds in the United States someone files for bankruptcy A soft credit report inquiry is the process wherein a company or an entity checks an individual’s credit report writing as a part of background check when that individual applies for a loan.	c4-train.00001-of-01024_parsed_xaa.conllu
SS	False	False	Sing	Not Pronoun	Sing	Not Pronoun	a lack of online presence or poorly managed social media ( Twitter account with Tweet posted years ago )	influences	influence	Sing	influence	root	Today, a lack of online presence or poorly managed social media (Twitter account with Tweet posted years ago) influences a person’s impression of you well before you say hello.	c4-train.00001-of-01024_parsed_xaa.conllu
PP	False	False	Plur	Not Pronoun	Plur	Not Pronoun	how many guys or gals	wish	wish	Plur	wish	acl	Once you log into your account, you will receive a message with details of how many guys or gals wish to meet you.	c4-train.00001-of-01024_parsed_xaa.conllu
UNK	False	False	Plur	Not Pronoun	UNK	Not Pronoun	A few years or longer ,	is	be	Sing	amount	cop	A few years or longer, in addition to their education, is a decent amount of time for a chiropractor to hone their skills.	c4-train.00001-of-01024_parsed_xaa.conllu
SS	False	False	Sing	Not Pronoun	Sing	Not Pronoun	the landlord or the agent	instructs	instruct	Sing	instruct	advcl	But, according to Imfuna Let, the UK’s leading inventory software solution, the independence and impartiality of a third party report can always be called into question, where the landlord or the agent instructs and pays their favoured independent provider to produce it.	c4-train.00001-of-01024_parsed_xaa.conllu
PP	False	False	Plur	Not Pronoun	Plur	Not Pronoun	Walk - in showers or wet rooms with glass screens	add	add	Plur	add	root	Walk-in showers or wet rooms with glass screens also add to the sense of space.	c4-train.00001-of-01024_parsed_xaa.conllu
SS	False	False	Sing	Not Pronoun	Sing	Not Pronoun	the cutting tool or chuck	is	be	Sing	standstill	cop	Disconnect the drilling/milling machine from the mains power, and ensure the cutting tool or chuck is at a complete standstill before attempting to change accessories, service or perform any maintenance.	c4-train.00001-of-01024_parsed_xaa.conllu
SS	False	False	Sing	Not Pronoun	Sing	Not Pronoun	your senior leader or manager	gives	give	Sing	give	ccomp	Imagine your senior leader or manager gives you a piece of paper and says, ‘I’d like you to write down an honest opinion you hold of me.	c4-train.00001-of-01024_parsed_xaa.conllu
SS	False	False	Sing	Not Pronoun	Sing	Not Pronoun	LST , or low - stress training ,	involves	involve	Sing	involve	root	LST, or low-stress training, involves bending branches to create multiple budding sites and increase yields dramatically.	c4-train.00001-of-01024_parsed_xaa.conllu
SS	False	False	Sing	Not Pronoun	Sing	Not Pronoun	Epoxy powder coating or polyester powder coating	is	be	Sing	option	cop	Epoxy powder coating or polyester powder coating is an option.	c4-train.00001-of-01024_parsed_xaa.conllu
PS	False	False	Plur	Not Pronoun	Sing	Not Pronoun	Buses or metro	drop	drop	Plur	drop	root	Buses or metro, while cheap, drop you off far from your destination.	c4-train.00001-of-01024_parsed_xaa.conllu
PS	False	False	Plur	3	Sing	Not Pronoun	they or their child	has	have	Sing	have	ccomp	Still, there have been many instances where teenage patients completed successful treatment and therefore anyone who suspects they or their child has lazy eye should consult immediately with their optometrist	c4-train.00001-of-01024_parsed_xaa.conllu
SS	False	False	Sing	Not Pronoun	Sing	Not Pronoun	harm reduction or harm minimisation	is	be	Sing	what	cop	What is harm reduction or harm minimisation?	c4-train.00001-of-01024_parsed_xaa.conllu
SS	False	False	Sing	3	Sing	3	he or she	becomes	become	Sing	become	root	Then he or she becomes a Pup in the Order.	c4-train.00001-of-01024_parsed_xaa.conllu
UNK	False	False	UNK	2	Sing	Not Pronoun	you or the receiver of the cards	are	be	Sing	go	aux	What are you or the receiver of the cards going through at this time?	c4-train.00001-of-01024_parsed_xaa.conllu
UNK	False	False	UNK	2	Sing	Not Pronoun	you , or the receiver of the cards ,	is	be	Sing	experience	aux	If you, or the receiver of the cards, is currently experiencing adversity in your life, consider buying a more detailed deck – perhaps one that also comes with a guidebook.	c4-train.00001-of-01024_parsed_xaa.conllu
SS	False	False	Sing	Not Pronoun	Sing	Not Pronoun	a boss or colleague	offers	offer	Sing	offer	advcl	There is nothing better when a boss or colleague offers a kind gesture or a show of support.	c4-train.00001-of-01024_parsed_xaa.conllu
SS	False	False	Sing	Not Pronoun	Sing	Not Pronoun	Gum reshaping – or contouring –	is	be	Sing	option	cop	Gum reshaping – or contouring – is an option for people wishing to change what’s commonly known as a ‘gummy smile’.	c4-train.00001-of-01024_parsed_xaa.conllu
UNK	False	False	UNK	Not Personal Pronoun	Sing	Not Pronoun	WHO or the sugar industry	has	have	Sing	back	aux	I wonder what's going on with the issue now, whether WHO or the sugar industry has backed down.	c4-train.00001-of-01024_parsed_xaa.conllu
SS	False	False	Sing	Not Pronoun	Sing	Not Pronoun	Starch , or amylum ,	is	be	Sing	carbohydrate	cop	Starch, or amylum, is a polymeric carbohydrate consisting of a large number of glucose units joined by glycosidic bonds.	c4-train.00001-of-01024_parsed_xaa.conllu
SS	False	False	Sing	Not Pronoun	Sing	Not Pronoun	your home or property	containing	contain		contain	acl	Unfortunately with living in Edmonton, the chance for your home or property containing asbestos is very high.	c4-train.00001-of-01024_parsed_xaa.conllu
UNK	False	False	UNK	2	Sing	Not Personal Pronoun	you or someone you know	suspects	suspect	Sing	suspect	advcl	If you or someone you know suspects that your home may be affected by Asbestos, call Canada’s Restoration Services.	c4-train.00001-of-01024_parsed_xaa.conllu
SS	False	False	Sing	Not Pronoun	Sing	Not Pronoun	the ' golden padlock ' or ' golden key '	appears	appear	Sing	appear	ccomp	You will notice when you get to the Secure Trading checkout that the 'golden padlock' or 'golden key' appears in the bottom right hand corner of your browser - this indicates that you are on a secure server and that your credit card details are safe.	c4-train.00001-of-01024_parsed_xaa.conllu
SS	False	False	Sing	Not Pronoun	Sing	Not Pronoun	your blog or website alone	does	do	Sing	have	aux	See your blog or website alone does not have an internal linking structure that is already optimized to bring what is called, “spiders” to your website or page that it does when your submit your article to article directories.	c4-train.00001-of-01024_parsed_xaa.conllu
SS	False	False	Sing	Not Pronoun	Sing	Not Pronoun	a major goal or obstacle that must be overcome and for something considerable to be achieved	be	be		be	xcomp	I like there to be a major goal or obstacle that must be overcome and for something considerable to be achieved.	c4-train.00001-of-01024_parsed_xaa.conllu
SS	False	False	Sing	3	Sing	3	he or she	pretends	pretend	Sing	pretend	parataxis	The official or person denying information is very cunning, he or she pretends that there is some special problem due to which information cannot be provided, when actually they are playing mind games to maximize the mental stress the person is experiencing.	c4-train.00001-of-01024_parsed_xaa.conllu
SS	False	False	Sing	Not Pronoun	Sing	Not Pronoun	your favorite tree or bush that will last last through the winter	's	be	Sing	what	cop	I'm looking to do some winter planters - what's your favorite tree or bush that will last last through the winter?	c4-train.00001-of-01024_parsed_xaa.conllu
